lawer,lawer_tpМС города Тольятти Самарской области,МС города Тольятти Самарской областиЛенский кассационный суд Смоленской области,Ленским кассационным судом Смоленской областиКозловский межрайонный суд г. Владивостока,Козловским межрайонным судом г. ВладивостокаНогликский город. суд г. Санкт-петербурга И ЛО,Ногликским городским судом г. Санкт-петербурга И ЛОФедеральный суд г. Орска,Федеральным судом г. ОрскаМС СУ №46 г. Тюмени,МС СУ №46 г. ТюмениБайкитский кассационный суд Волгоградской обл.,Байкитским кассационным судом Волгоградской обл.Тляратинский апелляционный суд Псковской области,Тляратинским апелляционным судом Псковской областиСорокинский городской суд Севастополя,Сорокинским городским судом СевастополяКунашакский районный суд Архангельской области,Кунашакским районным судом Архангельской областиАрбитражный суд Смоленской области,Арбитражным судом Смоленской областиМС города Тольятти Самарской обл.,МС города Тольятти Самарской обл.Джанкойский военный суд г. Саранска,Джанкойским военным судом г. СаранскаОстрогожский апелляционный суд г. Тулы,Острогожским апелляционным судом г. ТулыСудебный участок №115 Карачаево-черкесской республики,Судебным участком №115 Карачаево-черкесской республикиС/У №284 г. СПБ,С/У №284 г. СПБФедеральный участок западно-сибирского округа,Федеральным участком западно-сибирского округаБурейский военный суд рсо-алания,Бурейским военным судом рсо-аланияФ/У республика Калмыкия,Ф/У республика КалмыкияМССУ №211 Рязанской области,МССУ №211 Рязанской областиПеровский город суд города Санкт-петербург И Ленинградской области,Перовским городским судом города Санкт-петербург И Ленинградской областиФедеральный участок г. Иркутска,Федеральным участком г. ИркутскаНовоалександровский военный суд Ульяновской области,Новоалександровским военным судом Ульяновской областиШалинский городской суд г. Тамбова,Шалинским городским судом г. ТамбоваМС СУ №172 Пензенская обл.,МС СУ №172 Пензенская обл.Нагатинский город суд Ивановской области,Нагатинским городским судом Ивановской областиНижнетуринский город суд Тюменской области,Нижнетуринским городским судом Тюменской областиМичуринский районный суд Сахалинской области,Мичуринским районным судом Сахалинской областиКабанский апелляционный суд г. Красноярска,Кабанским апелляционным судом г. КрасноярскаКрасноярский город суд г. Владимира,Красноярским городским судом г. ВладимираАрбитражный суд республики Дагестана,Арбитражным судом республики ДагестанаАрбитражный суд республики Мордовия,Арбитражным судом республики МордовияМуромцевский апелляционный суд г. Саранска,Муромцевским апелляционным судом г. СаранскаАС г. Барнаула,АС г. БарнаулаС/У №9 г. Читы,С/У №9 г. ЧитыМ/С города Азов,М/С города АзовАксубаевский апелляционный суд г. Иркутска,Аксубаевским апелляционным судом г. ИркутскаНовоорский военный суд Ульяновской области,Новоорским военным судом Ульяновской областиМССУ №268 общей юрисдикции,МССУ №268 общей юрисдикцииИзмайловский городской суд республики Мордовия,Измайловским городским судом республики МордовияОрдынский районный суд Магаданской области,Ордынским районным судом Магаданской областиФедеральный участок Орловской области,Федеральным участком Орловской областиМС СУ №123 Рязанской области,МС СУ №123 Рязанской областиФУ города Азов,ФУ города АзовФедеральный участок г. Владикавказа,Федеральным участком г. ВладикавказаФедеральный участок г. Сыктывкара,Федеральным участком г. СыктывкараСокольский город. суд г. Хабаровска,Сокольским городским судом г. ХабаровскаБелоярский военный суд г. Симферополя,Белоярским военным судом г. СимферополяИнгодинский межрайонный суд города Тольятти Самарской области,Ингодинским межрайонным судом города Тольятти Самарской областиАльменевский межрайонный суд республики Северная осетия-алания,Альменевским межрайонным судом республики Северная осетия-аланияТопчихинский военный суд г. Краснодара,Топчихинским военным судом г. КраснодараМССУ №229 Псковской области,МССУ №229 Псковской областиФУ г. Новокузнецка,ФУ г. НовокузнецкаМС Псковской области,МС Псковской областиУсть-джегутинский город суд Пензенская ОБ.,Усть-джегутинским городским судом Пензенская ОБ.Беляевский военный суд г. Прокопьевска,Беляевским военным судом г. ПрокопьевскаФУ города Саратова,ФУ города СаратоваПадунский районный суд Ростовской области,Падунским районным судом Ростовской областиФС города н.новгорода,ФС города н.новгородаАС города нижний тагил Свердловской области,АС города нижний тагил Свердловской областиБаунтовский межрайонный суд г. Сочи,Баунтовским межрайонным судом г. СочиНикулинский районный суд г. Иркутска,Никулинским районным судом г. ИркутскаАрбитражный суд алтайского края,Арбитражным судом алтайского краяКачугский р-ый суд города Екатеринбурга Свердловской области,Качугским р-ым судом города Екатеринбурга Свердловской областиУльчский город суд Свердловская область,Ульчским городским судом Свердловская областьМС г. Кемерово,МС г. КемеровоШатурский м-ый суд г. Белгорода,Шатурским м-ым судом г. БелгородаАрбитражный суд Тверской области,Арбитражным судом Тверской областиДевятый апелляционный суд Тверской области,Девятым апелляционным судом Тверской областиФедеральный суд города Саратова,Федеральным судом города СаратоваФ/С Астраханской области,Ф/С Астраханской областиЗареченский межрайонный суд города нижний новгород,Зареченским межрайонным судом города нижний новгородМС ханты-мансийского автономного округа - югры,МС ханты-мансийского автономного округа - югрыАС ЕАО,АС ЕАОБалтасинский городской суд западно-сибирского округа,Балтасинским городским судом западно-сибирского округаКореневский кассационный суд г. Кемерово,Кореневским кассационным судом г. КемеровоМагасский м-ый суд города н.новгорода,Магасским м-ым судом города н.новгородаМС СУ №190 г. Смоленска,МС СУ №190 г. СмоленскаГубкинский город суд г. Перми,Губкинским городским судом г. ПермиТяжинский городской суд республика Калмыкия,Тяжинским городским судом республика КалмыкияБиробиджанский р-ый суд города Казань,Биробиджанским р-ым судом города КазаньМС СУ №47 г. Волгоград,МС СУ №47 г. ВолгоградБалашовский апелляционный суд приморского края,Балашовским апелляционным судом приморского краяЕльцовский город. суд г. Саранска,Ельцовским городским судом г. СаранскаМС г. Прокопьевска,МС г. ПрокопьевскаСтародубский кассационный суд Воронежской обл.,Стародубским кассационным судом Воронежской обл.Пресненский м-ый суд города Казань,Пресненским м-ым судом города КазаньАС Костромской области,АС Костромской областиЛобненский районный суд Чеченской республики,Лобненским районным судом Чеченской республикиОктябрьский м-ый суд приморского края,Октябрьским м-ым судом приморского краяБессоновский военный суд Пензенской области,Бессоновским военным судом Пензенской областиС/У №186 Белгородской обл.,С/У №186 Белгородской обл.Новотроицкий районный суд г. Владивостока,Новотроицким районным судом г. ВладивостокаКотовский военный суд Новгородской области,Котовским военным судом Новгородской областиМ/С респ.крым,М/С респ.крымКирилловский м-ый суд Волгоградской области,Кирилловским м-ым судом Волгоградской областиМС СУ №51 г. Саранска,МС СУ №51 г. СаранскаФедеральный суд республики Карелия,Федеральным судом республики КарелияС/У №43 г. Твери,С/У №43 г. ТвериБондарский районный суд республики Адыгея,Бондарским районным судом республики АдыгеяПригородный город. суд Курганской области,Пригородным городским судом Курганской областиАнгарский военный суд г. Саранска,Ангарским военным судом г. СаранскаАмурский кассационный суд г. Новосибирска,Амурским кассационным судом г. НовосибирскаМССУ №277 республика Коми,МССУ №277 республика КомиФ/У г. Кирова,Ф/У г. КироваКумылженский городской суд московского округа,Кумылженским городским судом московского округаСудебный участок №64 Новосибирской обл.,Судебным участком №64 Новосибирской обл.МССУ №243 Липецкой области,МССУ №243 Липецкой областиФедеральный участок г. Пензы,Федеральным участком г. ПензыМС ставропольский край,МС ставропольский крайПавлово-посадский военный суд чукотского автономного округа,Павлово-посадским военным судом чукотского автономного округаЧитинский апелляционный суд Вологодской области,Читинским апелляционным судом Вологодской областиМировой суд Иркутской обл.,Мировым судом Иркутской обл.Балашихинский город. суд г. Владикавказа,Балашихинским городским судом г. ВладикавказаНовозыбковский город. суд г. Каменск-уральского,Новозыбковским городским судом г. Каменск-уральскогоАхтынский областной суд г. Мурманска,Ахтынским областным судом г. МурманскаМС г. Екатеринбурга,МС г. ЕкатеринбургаЯгоднинский город суд Волгоградской обл.,Ягоднинским городским судом Волгоградской обл.Федеральный участок г. Новороссийска,Федеральным участком г. НовороссийскаАрбитражный суд г. нижний тагил,Арбитражным судом г. нижний тагилА/С г. Твери,А/С г. ТвериАС Кабардино-балкарской республики,АС Кабардино-балкарской республикиМоршанский город суд КК,Моршанским городским судом ККСудебный участок №189 г. Комсомольска-на-амуре,Судебным участком №189 г. Комсомольска-на-амуреФС республики Калмыкия,ФС республики КалмыкияКореновский районный суд г. Рязани,Кореновским районным судом г. РязаниМССУ №130 республики Бурятия,МССУ №130 республики БурятияСтарополтавский городской суд респ.бурятия,Старополтавским городским судом респ.бурятияТунгокоченский р-ый суд ямало-ненецкого автономного округа,Тунгокоченским р-ым судом ямало-ненецкого автономного округаИдринский городской суд Вологодской области,Идринским городским судом Вологодской областиБайкаловский город суд г. Самары,Байкаловским городским судом г. СамарыМССУ №125 г. Екатеринбурга Свердловской области,МССУ №125 г. Екатеринбурга Свердловской областиВеликолукский военный суд г. Орла,Великолукским военным судом г. ОрлаРадищевский р-ый суд г. Владикавказа,Радищевским р-ым судом г. ВладикавказаНикифоровский военный суд российской федерации,Никифоровским военным судом российской федерацииФ/У г. Казани,Ф/У г. КазаниСудебный участок №87 Пензенской области,Судебным участком №87 Пензенской областиМС г. Владивостока,МС г. ВладивостокаУнинский городской суд республики Мордовия,Унинским городским судом республики МордовияНамский районный суд респ.бурятия,Намским районным судом респ.бурятияМС СУ №167 г. Читы,МС СУ №167 г. ЧитыАС ХБ,АС ХБПредгорный м-ый суд города Санкт-петербурга И Ленинградской области,Предгорным м-ым судом города Санкт-петербурга И Ленинградской областиВидновский город. суд республики Татарстан,Видновским городским судом республики ТатарстанМировой суд МО,Мировым судом МОСарпинский город. суд Пензенская обл.,Сарпинским городским судом Пензенская обл.МС Карачаево-черкесской республики,МС Карачаево-черкесской республикиМамадышский р-ый суд МО,Мамадышским р-ым судом МОДорогобужский апелляционный суд г. Мурманска,Дорогобужским апелляционным судом г. МурманскаФУ поволжского округа,ФУ поволжского округаФедеральный суд Калужской области,Федеральным судом Калужской областиЗенковский м-ый суд г. Волгоград,Зенковским м-ым судом г. ВолгоградСудебный участок №286 респ.крым,Судебным участком №286 респ.крымУлетовский кассационный суд г. Белгорода,Улётовским кассационным судом г. БелгородаШилкинский военный суд г. Чебоксары,Шилкинским военным судом г. ЧебоксарыМС СУ №157 Липецкой области,МС СУ №157 Липецкой областиСухобузимский районный суд Вологодской области,Сухобузимским районным судом Вологодской областиСудебный участок №138 г. Ульяновска,Судебным участком №138 г. УльяновскаСеребряно-прудский районный суд города Волгоград,Серебряно-прудским районным судом города ВолгоградАС Курской области,АС Курской областиФедеральный суд г. Новосибирска,Федеральным судом г. НовосибирскаПартизанский город. суд г. Самары,Партизанским городским судом г. СамарыПриютненский р-ый суд Пензенская обл.,Приютненским р-ым судом Пензенская обл.Сут-хольский районный суд г. Тольятти,Сут-хольским районным судом г. ТольяттиТрубчевский городской суд г. Воронежа,Трубчевским городским судом г. ВоронежаШарыповский военный суд г. Братска,Шарыповским военным судом г. БратскаМагдагачинский городской суд республики Марий ЭЛ,Магдагачинским городским судом республики Марий ЭЛСоломбальский апелляционный суд г. Прокопьевска,Соломбальским апелляционным судом г. ПрокопьевскаФ/У г. СПБ,Ф/У г. СПБМировой суд г. Орла,Мировым судом г. ОрлаПрикубанский город. суд РБ,Прикубанским городским судом РББелореченский военный суд российской федерации,Белореченским военным судом российской федерацииКиришский р-ый суд Чеченской республики,Киришским р-ым судом Чеченской республикиФедеральный суд Орловской области,Федеральным судом Орловской областиАрбитражный суд республики Алтай,Арбитражным судом республики АлтайИжморский кассационный суд республики Северная осетия-алания,Ижморским кассационным судом республики Северная осетия-аланияФС г. Севастополя,ФС г. СевастополяЮрьев-польский город. суд г. Новороссийска,Юрьевым-польским городским судом г. НовороссийскаС/У №213 г. Тулы,С/У №213 г. ТулыМинераловодский город. суд города Азов,Минераловодским городским судом города АзовАчхой-мартановский областной суд города нижний тагил Свердловской области,Ачхой-мартановским областным судом города нижний тагил Свердловской областиФ/С ставропольский край,Ф/С ставропольский крайФедеральный суд общей юрисдикции,Федеральным судом общей юрисдикцииСудебный участок №205 респ. Башкортостан,Судебным участком №205 респ. БашкортостанНовоалтайский межрайонный суд г. Новокузнецка,Новоалтайским межрайонным судом г. НовокузнецкаВасилеостровский районный суд республики Татарстан,Василеостровским районным судом республики ТатарстанЯшкинский городской суд республики Крым,Яшкинским городским судом республики КрымАрбитражный суд забайкальского края,Арбитражным судом забайкальского краяМС СУ №116 Ярославской области,МС СУ №116 Ярославской областиФУ республики Карелия,ФУ республики КарелияА/С г. Анапа,А/С г. АнапаТбилисский город. суд пермского края,Тбилисским городским судом пермского края