lawer,lawer_tpКлявлинский апелляционный суд Чеченской республики,Клявлинским апелляционным судом Чеченской республикиХангаласский м-ый суд Нижегородской обл.,Хангаласским м-ым судом Нижегородской обл.М/С г. Саратова,М/С г. СаратоваПавлоградский военный суд г. Абакан,Павлоградским военным судом г. АбаканФедеральный суд Чеченской республики,Федеральным судом Чеченской республикиБугурусланский м-ый суд Иркутской области,Бугурусланским м-ым судом Иркутской областиСудебный участок №72 Пензенская ОБ.,Судебным участком №72 Пензенская ОБ.Кимовский апелляционный суд города Тольятти,Кимовским апелляционным судом города ТольяттиФС Тульской области,ФС Тульской областиМС г. Сыктывкара,МС г. СыктывкараСУ №138 г. Красноярска,СУ №138 г. КрасноярскаА/С Брянской области,А/С Брянской областиШиринский районный суд УР,Ширинским районным судом УРФедеральный суд города Тольятти,Федеральным судом города ТольяттиМировой суд Костромской области,Мировым судом Костромской областиФедеральный участок г. Перми,Федеральным участком г. ПермиЕнисейский областной суд г. Ульяновска,Енисейским областным судом г. УльяновскаСтупинский межрайонный суд республики Адыгеи,Ступинским межрайонным судом республики АдыгеиФУ г. Магнитогорска,ФУ г. МагнитогорскаАС российской федерации,АС российской федерацииФС Белгородской обл.,ФС Белгородской обл.ФС республики Тыва,ФС республики ТываПеревозский р-ый суд г. Прокопьевска,Перевозским р-ым судом г. ПрокопьевскаОленинский районный суд г. Тамбова,Оленинским районным судом г. ТамбоваСычевский областной суд ставропольского края,Сычёвским областным судом ставропольского краяНазаровский город суд города Москвы,Назаровским городским судом города МосквыА/С республики Ингушетия,А/С республики ИнгушетияАрбитражный суд Владимирской области,Арбитражным судом Владимирской областиПугачевский город суд Томской области,Пугачёвским городским судом Томской областиФ/У Кемеровской области,Ф/У Кемеровской областиНовоузенский кассационный суд Челябинской области,Новоузенским кассационным судом Челябинской областиЧемальский военный суд республики Мордовия,Чемальским военным судом республики МордовияМировой суд Кировской области,Мировым судом Кировской областиМС СУ №102 ханты-мансийского автономного округа - югры,МС СУ №102 ханты-мансийского автономного округа - югрыТындинский областной суд Сахалинской области,Тындинским областным судом Сахалинской областиСУ №54 Брянской области,СУ №54 Брянской областиФ/У республики Дагестан,Ф/У республики ДагестанЗмеиногорский р-ый суд города Екатеринбурга Свердловской области,Змеиногорским р-ым судом города Екатеринбурга Свердловской областиКондопожский межрайонный суд г. дагестанские огни,Кондопожским межрайонным судом г. дагестанские огниАчинский апелляционный суд города Санкт-петербурга,Ачинским апелляционным судом города Санкт-петербургаМССУ №9 г. Казани,МССУ №9 г. КазаниКувандыкский м-ый суд АК,Кувандыкским м-ым судом АККамчатский городской суд Санкт-петербурга,Камчатским городским судом Санкт-петербургаС/У №103 города н.новгород,С/У №103 города н.новгородКрутинский военный суд г. Кемерово,Крутинским военным судом г. КемеровоКисловодский районный суд г. Каменск-уральского,Кисловодским районным судом г. Каменск-уральскогоАрдонский город. суд Мурманской области,Ардонским городским судом Мурманской областиМС СУ №227 чувашской республики - чувашии,МС СУ №227 чувашской республики - чувашииМировой суд республики Алтай,Мировым судом республики АлтайКирово-чепецкий город. суд Мурманской области,Кирово-чепецким городским судом Мурманской областиАлексеевский город суд Ивановской области,Алексеевским городским судом Ивановской областиСусуманский апелляционный суд чувашской республики,Сусуманским апелляционным судом чувашской республикиСудакский апелляционный суд г. нижний тагил,Судакским апелляционным судом г. нижний тагилТроицко-печорский р-ый суд г. Санкт-петербурга И ЛО,Троицко-печорским р-ым судом г. Санкт-петербурга И ЛОМалокарачаевский городской суд респ.хакасия,Малокарачаевским городским судом респ.хакасияМ/С г. Кемерово,М/С г. КемеровоДорогомиловский м-ый суд г. Саратова,Дорогомиловским м-ым судом г. СаратоваАС города Каменск-уральского Свердловской области,АС города Каменск-уральского Свердловской областиМС СУ №278 города Санкт-петербург,МС СУ №278 города Санкт-петербургСевастопольский город суд республики Саха (якутия),Севастопольским городским судом республики Саха (якутия)Нязепетровский м-ый суд ставропольский край,Нязепетровским м-ым судом ставропольский крайГатчинский м-ый суд Новгородской области,Гатчинским м-ым судом Новгородской областиМ/С г. Орла,М/С г. ОрлаТюменцевский город. суд РТ,Тюменцевским городским судом РТФУ Санкт-петербурга,ФУ Санкт-петербургаГородищенский город. суд республики Татарстан,Городищенским городским судом республики ТатарстанСевероуральский районный суд РБ,Североуральским районным судом РБМССУ №81 г. Воронежа,МССУ №81 г. ВоронежаУржумский городской суд г. Тольятти,Уржумским городским судом г. ТольяттиМировой суд республики Адыгея,Мировым судом республики АдыгеяМ/С краснодарского края,М/С краснодарского краяРтищевский городской суд города Севастополя,Ртищевским городским судом города СевастополяАС РТ,АС РТНефтекумский город. суд Пензенская обл.,Нефтекумским городским судом Пензенская обл.Федеральный участок республики Татарстан,Федеральным участком республики ТатарстанМССУ №233 города Севастополя,МССУ №233 города СевастополяА/С Вологодской области,А/С Вологодской областиФС Рязанской области,ФС Рязанской областиМС Владимирской области,МС Владимирской областиФ/У города Тольятти,Ф/У города ТольяттиЧерняховский районный суд республики Бурятия,Черняховским районным судом республики БурятияФ/С г. Архангельска,Ф/С г. АрхангельскаФедеральный участок Новгородской области,Федеральным участком Новгородской областиЮрлинский военный суд города Твери Тверской области,Юрлинским военным судом города Твери Тверской областиФС УР,ФС УРКлючевский апелляционный суд Калининградской области,Ключевским апелляционным судом Калининградской областиКраснинский областной суд г. Твери,Краснинским областным судом г. ТвериМС СУ №135 г. Иваново,МС СУ №135 г. ИвановоСортавальский город. суд г. СПБ И ЛО,Сортавальским городским судом г. СПБ И ЛОС/У №136 г. Тюмени,С/У №136 г. ТюмениМС Самарской обл.,МС Самарской обл.Таштыпский областной суд Архангельской области,Таштыпским областным судом Архангельской областиФедеральный участок Московской области,Федеральным участком Московской областиФС краснодарского края,ФС краснодарского краяКузьминский апелляционный суд г. Липецка,Кузьминским апелляционным судом г. ЛипецкаАлексинский город. суд Санкт-петербурга,Алексинским городским судом Санкт-петербургаБалаковский городской суд г. Новокузнецка,Балаковским городским судом г. НовокузнецкаМС республики Северная осетия-алания,МС республики Северная осетия-аланияФ/У республики Калмыкия,Ф/У республики КалмыкияПоловинский апелляционный суд РО,Половинским апелляционным судом РОСудебный участок №76 республики Марий ЭЛ,Судебным участком №76 республики Марий ЭЛЦивильский городской суд Саратовской области,Цивильским городским судом Саратовской областиДедовичский военный суд Псковской области,Дедовичским военным судом Псковской областиФ/С забайкальского края,Ф/С забайкальского краяБарышский апелляционный суд чувашской республики,Барышским апелляционным судом чувашской республикиИвдельский военный суд г. Костромы,Ивдельским военным судом г. КостромыНабережночелнинский город. суд г. Читы,Набережночелнинским городским судом г. ЧитыДульдургинский р-ый суд республики Марий ЭЛ,Дульдургинским р-ым судом республики Марий ЭЛИскитимский районный суд Липецкой области,Искитимским районным судом Липецкой областиА/С г. Санкт-петербурга И ЛО,А/С г. Санкт-петербурга И ЛОПравдинский межрайонный суд Томской области,Правдинским межрайонным судом Томской областиФУ РБ,ФУ РББезенчукский городской суд Брянской области,Безенчукским городским судом Брянской областиДимитровградский кассационный суд г. Махачкалы,Димитровградским кассационным судом г. МахачкалыАС республики Калмыкия,АС республики КалмыкияНижнеудинский районный суд г. Рязани,Нижнеудинским районным судом г. РязаниМировой суд Новгородской области,Мировым судом Новгородской областиВыксунский апелляционный суд общей юрисдикции,Выксунским апелляционным судом общей юрисдикцииКизеловский областной суд Ростовской области,Кизеловским областным судом Ростовской областиКочубеевский военный суд республики Саха,Кочубеевским военным судом республики СахаЛюблинский город суд города Саратова,Люблинским городским судом города СаратоваМС СУ №115 города Азов,МС СУ №115 города АзовФ/У г. Екатеринбурга,Ф/У г. ЕкатеринбургаИрафский апелляционный суд г. Курска,Ирафским апелляционным судом г. КурскаНижнесергинский город суд Омской области,Нижнесергинским городским судом Омской областиАС московского округа,АС московского округаЧамзинский районный суд Волгоградской области,Чамзинским районным судом Волгоградской областиМССУ №179 республики Марий ЭЛ,МССУ №179 республики Марий ЭЛМС г. Орла,МС г. ОрлаФ/У алтайского края,Ф/У алтайского краяФУ г. Кирова,ФУ г. КироваСУ №254 республики Саха,СУ №254 республики СахаАС Самарской обл.,АС Самарской обл.Арбитражный суд респ.татарстан,Арбитражным судом респ.татарстанФ/У Иркутской обл.,Ф/У Иркутской обл.Усть-илимский город суд респ.бурятия,Усть-илимским городским судом респ.бурятияСУ №110 ханты-мансийского автономного округа - югры,СУ №110 ханты-мансийского автономного округа - югрыФ/У Волгоградской обл.,Ф/У Волгоградской обл.Дудинский районный суд города Каменск-уральского Свердловской области,Дудинским районным судом города Каменск-уральского Свердловской областиПетропавловский кассационный суд г. Ульяновска,Петропавловским кассационным судом г. УльяновскаФС Сахалинской области,ФС Сахалинской областиАльшеевский город. суд Томской области,Альшеевским городским судом Томской областиФ/У г. Грозного,Ф/У г. ГрозногоКольчугинский межрайонный суд города Волгоград,Кольчугинским межрайонным судом города ВолгоградБарун-хемчикский р-ый суд г. Челябинска,Барун-хемчикским р-ым судом г. ЧелябинскаМ/С города Санкт-петербурга И ЛО,М/С города Санкт-петербурга И ЛОЗакаменский м-ый суд города н.новгород,Закаменским м-ым судом города н.новгородКерченский м-ый суд Ростовской обл.,Керченским м-ым судом Ростовской обл.С/У №162 респ. Татарстан,С/У №162 респ. ТатарстанФ/С Пензенская ОБ.,Ф/С Пензенская ОБ.Ногайский город. суд г. Ижевска,Ногайским городским судом г. ИжевскаФ/У республики Адыгея,Ф/У республики АдыгеяБазарно-карабулакский м-ый суд г. Владивостока,Базарно-карабулакским м-ым судом г. ВладивостокаВуктыльский межрайонный суд республики Бурятия,Вуктыльским межрайонным судом республики БурятияТавдинский р-ый суд республики Ингушетия,Тавдинским р-ым судом республики ИнгушетияМС республики Башкортостан,МС республики БашкортостанФедеральный суд КК,Федеральным судом ККЧебулинский военный суд Томской области,Чебулинским военным судом Томской областиПильнинский межрайонный суд Астраханской области,Пильнинским межрайонным судом Астраханской областиСудебный участок №71 Кировской области,Судебным участком №71 Кировской областиВаргашинский межрайонный суд республики Крым,Варгашинским межрайонным судом республики КрымФС Пензенская обл.,ФС Пензенская обл.М/С Амурской области,М/С Амурской областиСолтонский областной суд Иркутской обл.,Солтонским областным судом Иркутской обл.Федеральный участок республики Карелия,Федеральным участком республики КарелияМС г. Анапа,МС г. АнапаАрбитражный суд г. дагестанские огни,Арбитражным судом г. дагестанские огниСУ №241 Нижегородская обл.,СУ №241 Нижегородская обл.Валуйский р-ый суд Калининградской области,Валуйским р-ым судом Калининградской областиКомаричский военный суд республики Адыгея,Комаричским военным судом республики АдыгеяФедеральный суд г. Прокопьевска,Федеральным судом г. ПрокопьевскаИглинский военный суд респ.татарстан,Иглинским военным судом респ.татарстанОсинниковский областной суд Смоленской области,Осинниковским областным судом Смоленской областиСараевский областной суд г. СПБ,Сараевским областным судом г. СПБАшинский м-ый суд г. лесного,Ашинским м-ым судом г. лесногоБахчисарайский город. суд города н.новгород,Бахчисарайским городским судом города н.новгородНадтеречный межрайонный суд г. Краснодара,Надтеречным межрайонным судом г. КраснодараИрбитский кассационный суд города Санкт-петербург И Ленинградской области,Ирбитским кассационным судом города Санкт-петербург И Ленинградской областиИвантеевский р-ый суд г. Тулы,Ивантеевским р-ым судом г. ТулыБогатовский город суд республики Бурятия,Богатовским городским судом республики БурятияАрбитражный суд Еврейской автономной области,Арбитражным судом Еврейской автономной областиФедеральный суд г. Владикавказа,Федеральным судом г. ВладикавказаДрожжановский апелляционный суд Новосибирской области,Дрожжановским апелляционным судом Новосибирской областиМартыновский районный суд Ленинградской области,Мартыновским районным судом Ленинградской областиФС города Саратова,ФС города СаратоваБобровский городской суд республики Алтай,Бобровским городским судом республики АлтайПоспелихинский кассационный суд Белгородской области,Поспелихинским кассационным судом Белгородской областиФедеральный участок г. Санкт-петербурга,Федеральным участком г. Санкт-петербургаПалехский м-ый суд республики Мордовия,Палехским м-ым судом республики МордовияИлишевский город. суд Кабардино-балкарской республики,Илишевским городским судом Кабардино-балкарской республикиАнадырский м-ый суд г. Абакан,Анадырским м-ым судом г. АбаканУссурийский межрайонный суд г. Рязани,Уссурийским межрайонным судом г. РязаниШабалинский апелляционный суд г. Иваново,Шабалинским апелляционным судом г. ИвановоМС СУ №211 г. Тольятти,МС СУ №211 г. ТольяттиСосногорский город суд города Сочи краснодарского края,Сосногорским городским судом города Сочи краснодарского краяЛотошинский районный суд Удмуртской республики,Лотошинским районным судом Удмуртской республики