lawer,lawer_tpКемский городской суд Тверской области,Кемским городским судом Тверской областиА/С г. Симферополя,А/С г. СимферополяЮстинский р-ый суд республики Марий ЭЛ,Юстинским р-ым судом республики Марий ЭЛМценский кассационный суд г. Самары,Мценским кассационным судом г. СамарыС/У №144 Карачаево-черкесской республики,С/У №144 Карачаево-черкесской республикиУсть-куломский апелляционный суд Курской области,Усть-куломским апелляционным судом Курской областиКанский областной суд Свердловская область,Канским областным судом Свердловская областьМировой суд cаратовской области,Мировым судом cаратовской областиЖердевский город. суд Карачаево-черкесской республики,Жердевским городским судом Карачаево-черкесской республикиЗамоскворецкий районный суд г. Абакан,Замоскворецким районным судом г. АбаканУярский кассационный суд Свердловская область,Уярским кассационным судом Свердловская областьАрбитражный суд г. Благовещенск,Арбитражным судом г. БлаговещенскПоворинский апелляционный суд Тюменской области,Поворинским апелляционным судом Тюменской областиНижнегорский городской суд г. Братска,Нижнегорским городским судом г. БратскаГорномарийский кассационный суд Оренбургской области,Горномарийским кассационным судом Оренбургской областиТукаевский областной суд Воронежской области,Тукаевским областным судом Воронежской областиКолпашевский областной суд г. Кирова,Колпашевским областным судом г. КироваВыборгский военный суд города Твери Тверской области,Выборгским военным судом города Твери Тверской областиХотынецкий м-ый суд АК,Хотынецким м-ым судом АККропоткинский город. суд г. Екатеринбурга,Кропоткинским городским судом г. ЕкатеринбургаПошехонский кассационный суд г. Абакан,Пошехонским кассационным судом г. АбаканДесногорский город суд Волгоградской обл.,Десногорским городским судом Волгоградской обл.Могойтуйский город суд республики Тыва,Могойтуйским городским судом республики ТываСретенский военный суд Тверской области,Сретенским военным судом Тверской областиСимоновский апелляционный суд республики Хакасия,Симоновским апелляционным судом республики ХакасияЗаиграевский м-ый суд г. новая ляля,Заиграевским м-ым судом г. новая ляляМС Кабардино-балкарской республики,МС Кабардино-балкарской республикиЛьговский апелляционный суд респ.бурятия,Льговским апелляционным судом респ.бурятияФ/У республики Дагестана,Ф/У республики ДагестанаФ/С г. Благовещенск,Ф/С г. БлаговещенскАрхаринский военный суд г. Балахна,Архаринским военным судом г. БалахнаКуединский м-ый суд ставропольский край,Куединским м-ым судом ставропольский крайА/С г. Читы,А/С г. ЧитыИгарский апелляционный суд Еврейской автономной области,Игарским апелляционным судом Еврейской автономной областиКовровский р-ый суд города Волгоград,Ковровским р-ым судом города ВолгоградЧеремховский город. суд г. СПБ И ЛО,Черемховским городским судом г. СПБ И ЛОТарногский р-ый суд города Твери Тверской области,Тарногским р-ым судом города Твери Тверской областиЧертановский межрайонный суд г. Симферополя,Чертановским межрайонным судом г. СимферополяБогдановичский город. суд респ.хакасия,Богдановичским городским судом респ.хакасияС/У №224 нижегородский обл.,С/У №224 нижегородский обл.АС г. Тулы,АС г. ТулыЛукояновский районный суд московского округа,Лукояновским районным судом московского округаМагарамкентский городской суд Пензенской области,Магарамкентским городским судом Пензенской областиЛунинский военный суд г. Махачкалы,Лунинским военным судом г. МахачкалыМС г. Симферополя,МС г. СимферополяПушкиногорский апелляционный суд г. Омска,Пушкиногорским апелляционным судом г. ОмскаМировой суд республики Хакасия,Мировым судом республики ХакасияНовохоперский военный суд РБ,Новохопёрским военным судом РБСудебный участок №41 города Санкт-петербурга,Судебным участком №41 города Санкт-петербургаАзовский кассационный суд краснодарского края,Азовским кассационным судом краснодарского краяФ/С г. Саратова,Ф/С г. СаратоваСунтарский апелляционный суд г. Воронежа,Сунтарским апелляционным судом г. ВоронежаУсть-енисейский город суд г. Орла,Усть-енисейским городским судом г. ОрлаБеловский районный суд г. Белгорода,Беловским районным судом г. БелгородаМС г. Тюмени,МС г. ТюмениКолпинский районный суд Нижегородской области,Колпинским районным судом Нижегородской областиЮкаменский город. суд г. Перми,Юкаменским городским судом г. ПермиС/У №226 города Санкт-петербург И Ленинградской области,С/У №226 города Санкт-петербург И Ленинградской областиЯшкульский межрайонный суд Смоленской области,Яшкульским межрайонным судом Смоленской областиПочинковский военный суд республики Карелия,Починковским военным судом республики КарелияМССУ №105 г. Брянска,МССУ №105 г. БрянскаАртемовский р-ый суд г. Санкт-петербурга,Артемовским р-ым судом г. Санкт-петербургаДигорский районный суд города Санкт-петербурга И ЛО,Дигорским районным судом города Санкт-петербурга И ЛОЗаволжский апелляционный суд города Каменск-уральского Свердловской области,Заволжским апелляционным судом города Каменск-уральского Свердловской областиМировой суд республики Башкортостан,Мировым судом республики БашкортостанШушенский город суд Московской области,Шушенским городским судом Московской областиКлимовский апелляционный суд г. Саранска,Климовским апелляционным судом г. СаранскаЧебоксарский город. суд ХБ,Чебоксарским городским судом ХБЧугуевский межрайонный суд г. Симферополя,Чугуевским межрайонным судом г. СимферополяМаксатихинский городской суд г. Санкт-петербурга И ЛО,Максатихинским городским судом г. Санкт-петербурга И ЛОЧетвертый межрайонный суд города Санкт-петербурга,Четвёртым межрайонным судом города Санкт-петербургаАС города н.новгород,АС города н.новгородФ/У ставропольский край,Ф/У ставропольский крайАгинский м-ый суд г. Тулы,Агинским м-ым судом г. ТулыЛабытнангский районный суд г. Владимира,Лабытнангским районным судом г. ВладимираЖелезноводский апелляционный суд респ.крым,Железноводским апелляционным судом респ.крымБатайский кассационный суд Нижегородской обл.,Батайским кассационным судом Нижегородской обл.Тобольский межрайонный суд г. Костромы,Тобольским межрайонным судом г. КостромыАС забайкальского края,АС забайкальского краяМССУ №69 города н.новгорода,МССУ №69 города н.новгородаПолярнозоринский городской суд г. Твери,Полярнозоринским городским судом г. ТвериМ/С г. Магнитогорска,М/С г. МагнитогорскаФедеральный участок российской федерации,Федеральным участком российской федерацииЛазовский город. суд г. Тюмени,Лазовским городским судом г. ТюмениЗеленчукский межрайонный суд Псковской области,Зеленчукским межрайонным судом Псковской областиФедеральный участок г. Мурманска,Федеральным участком г. МурманскаМировой суд Нижегородской обл.,Мировым судом Нижегородской обл.Каякентский межрайонный суд Самарской области,Каякентским межрайонным судом Самарской областиСУ №172 республика Коми,СУ №172 республика КомиФ/С города Санкт-петербург И Ленинградской области,Ф/С города Санкт-петербург И Ленинградской областиАС республики Марий ЭЛ,АС республики Марий ЭЛФС ханты-мансийского автономного округа - югры,ФС ханты-мансийского автономного округа - югрыФедеральный участок г. Красноярска,Федеральным участком г. КрасноярскаЗаречный областной суд города нижний новгород,Заречным областным судом города нижний новгородСемилукский межрайонный суд Удмуртской республики,Семилукским межрайонным судом Удмуртской республикиКазбековский город суд г. Каменск-уральского,Казбековским городским судом г. Каменск-уральскогоС/У №171 г. Владимира,С/У №171 г. ВладимираСальский областной суд Омской области,Сальским областным судом Омской областиВязниковский город. суд немецкого национального района,Вязниковским городским судом немецкого национального районаФ/У респ.башкортостан,Ф/У респ.башкортостанФ/С г. Симферополя,Ф/С г. СимферополяТретьяковский областной суд г. Воронежа,Третьяковским областным судом г. ВоронежаУспенский районный суд г. Челябинска,Успенским районным судом г. ЧелябинскаДемидовский город суд чувашской республики,Демидовским городским судом чувашской республикиФС г. Саранска,ФС г. СаранскаКолпнянский военный суд г. Прокопьевска,Колпнянским военным судом г. ПрокопьевскаУгловский военный суд Калининградской области,Угловским военным судом Калининградской областиНадеждинский город. суд г. Краснодара,Надеждинским городским судом г. КраснодараФ/С г. дагестанские огни,Ф/С г. дагестанские огниМ/С города Комсомольска-на-амуре хабаровского края,М/С города Комсомольска-на-амуре хабаровского краяНовоселицкий военный суд красноярского края,Новоселицким военным судом красноярского краяФ/С поволжского округа,Ф/С поволжского округаТулунский городской суд Нижегородской области,Тулунским городским судом Нижегородской областиФУ республики Марий ЭЛ,ФУ республики Марий ЭЛМС СУ №98 Владимирской области,МС СУ №98 Владимирской областиФУ респ.хакасия,ФУ респ.хакасияАркадакский областной суд Тульской области,Аркадакским областным судом Тульской областиФедеральный участок Волгоградской обл.,Федеральным участком Волгоградской обл.МССУ №135 г. Владимира,МССУ №135 г. ВладимираБашмаковский город суд Нижегородской обл.,Башмаковским городским судом Нижегородской обл.Стерлибашевский областной суд респ. Башкортостан,Стерлибашевским областным судом респ. БашкортостанС/У №216 г. Новосибирска,С/У №216 г. НовосибирскаМС СУ №218 республики Калмыкия,МС СУ №218 республики КалмыкияФ/С красноярского края,Ф/С красноярского краяПуровский районный суд г. Белгорода,Пуровским районным судом г. БелгородаБрянский м-ый суд Курской области,Брянским м-ым судом Курской областиЧернышковский город суд республики Татарстан,Чернышковским городским судом республики ТатарстанФУ г. Орска,ФУ г. ОрскаФС респ.мордовия,ФС респ.мордовияМС СУ №52 Смоленской области,МС СУ №52 Смоленской областиКанашский город. суд Новосибирской обл.,Канашским городским судом Новосибирской обл.Большемурашкинский межрайонный суд города Саратова,Большемурашкинским межрайонным судом города СаратоваЗалегощенский апелляционный суд города Абакан,Залегощенским апелляционным судом города АбаканПохвистневский кассационный суд республики Коми,Похвистневским кассационным судом республики КомиМС СУ №204 поволжского округа,МС СУ №204 поволжского округаЗеленодольский р-ый суд Кабардино-балкарской республики,Зеленодольским р-ым судом Кабардино-балкарской республикиС/У №137 ямало-ненецкого автономного округа,С/У №137 ямало-ненецкого автономного округаСудебный участок №156 г. лесного,Судебным участком №156 г. лесногоКовернинский город. суд Ленинградской области,Ковернинским городским судом Ленинградской областиРомненский кассационный суд г. Орска,Ромненским кассационным судом г. ОрскаСлавский апелляционный суд московского округа,Славским апелляционным судом московского округаУсть-камчатский районный суд города Санкт-петербург И Ленинградской области,Усть-камчатским районным судом города Санкт-петербург И Ленинградской областиМировой суд г. дагестанские огни,Мировым судом г. дагестанские огниЧернышевский город. суд РБ,Чернышевским городским судом РБФедеральный суд респ.татарстан,Федеральным судом респ.татарстанМС СУ №271 г. СПБ,МС СУ №271 г. СПБФУ чувашской республики,ФУ чувашской республикиЛюберецкий городской суд нижегородский обл.,Люберецким городским судом нижегородский обл.ФС г. Магнитогорска,ФС г. МагнитогорскаСУ №278 рсо-алания,СУ №278 рсо-аланияИрбейский апелляционный суд г. Владивостока,Ирбейским апелляционным судом г. ВладивостокаТерский военный суд г. Брянска,Терским военным судом г. БрянскаФУ города Казани,ФУ города КазаниЧарышский р-ый суд Тверской области,Чарышским р-ым судом Тверской областиКузнецкий м-ый суд города Комсомольска-на-амуре хабаровского края,Кузнецким м-ым судом города Комсомольска-на-амуре хабаровского краяС/У №12 Ивановской области,С/У №12 Ивановской областиМамско-чуйский городской суд РБ,Мамско-чуйским городским судом РБСеливановский областной суд красноярского края,Селивановским областным судом красноярского краяВерхнекетский кассационный суд Кабардино-балкарской республики,Верхнекетским кассационным судом Кабардино-балкарской республикиЗабайкальский районный суд МО,Забайкальским районным судом МОФ/С г. Воронежа,Ф/С г. ВоронежаСудебный участок №223 Тамбовской области,Судебным участком №223 Тамбовской областиГрязовецкий городской суд Архангельской области,Грязовецким городским судом Архангельской областиА/С западно-сибирского округа,А/С западно-сибирского округаВелижский апелляционный суд алтайского края,Велижским апелляционным судом алтайского краяОсинский город суд города Санкт-петербург И Ленинградской области,Осинским городским судом города Санкт-петербург И Ленинградской областиСинарский кассационный суд Волгоградской области,Синарским кассационным судом Волгоградской областиСелемджинский город суд респ.башкортостан,Селемджинским городским судом респ.башкортостанМировой суд г. Белгорода,Мировым судом г. БелгородаЦелинный город суд г. Братска,Целинным городским судом г. БратскаСысертский межрайонный суд респ.башкортостан,Сысертским межрайонным судом респ.башкортостанКимрский город суд чукотского автономного округа,Кимирским городским судом чукотского автономного округаПриморско-ахтарский городской суд респ.крым,Приморско-ахтарским городским судом респ.крымЩербинский апелляционный суд г. Липецка,Щербинским апелляционным судом г. ЛипецкаНанайский город суд г. Каменск-уральского,Нанайским городским судом г. Каменск-уральскогоБаевский областной суд г. Калининграда,Баевским областным судом г. КалининградаЛаишевский апелляционный суд рсо-алания,Лаишевским апелляционным судом рсо-аланияМС СУ №106 г. Анапа,МС СУ №106 г. АнапаА/С АК,А/С АКМССУ №169 города Тольятти Самарской области,МССУ №169 города Тольятти Самарской областиАС приморского края,АС приморского краяКраснознаменский межрайонный суд г. Каменск-уральского,Краснознаменским межрайонным судом г. Каменск-уральскогоМССУ №123 Вологодской области,МССУ №123 Вологодской областиЧановский кассационный суд г. Ижевска,Чановским кассационным судом г. ИжевскаМ/С г. Читы,М/С г. Читы