lawer,lawer_tpФ/С города Комсомольска-на-амуре хабаровского края,Ф/С города Комсомольска-на-амуре хабаровского краяМещанский кассационный суд приморского края,Мещанским кассационным судом приморского краяФУ г. Прокопьевска,ФУ г. ПрокопьевскаИзобильненский апелляционный суд Новгородской области,Изобильненским апелляционным судом Новгородской областиКулундинский апелляционный суд Волгоградской области,Кулундинским апелляционным судом Волгоградской областиЧерноярский городской суд г. Калининграда,Черноярским городским судом г. КалининградаМировой суд города Санкт-петербурга И ЛО,Мировым судом города Санкт-петербурга И ЛОГвардейский р-ый суд российской федерации,Гвардейским р-ым судом российской федерацииАтнинский кассационный суд г. Сыктывкара,Атнинским кассационным судом г. СыктывкараЕвпаторийский областной суд республики Адыгея,Евпаторийским областным судом республики АдыгеяСудебный участок №54 г. Волгограда,Судебным участком №54 г. ВолгоградаСтаропромысловский м-ый суд РО,Старопромысловским м-ым судом РОПировский городской суд республики Коми,Пировским городским судом республики КомиСудебный участок №144 чукотского автономного округа,Судебным участком №144 чукотского автономного округаМировой суд республики Ингушетия,Мировым судом республики ИнгушетияВятскополянский областной суд Калининградской области,Вятскополянским областным судом Калининградской областиМС Свердловская область,МС Свердловская областьГусь-хрустальный межрайонный суд города Севастополя,Гусь-хрустальным межрайонным судом города СевастополяФ/У г. Костромы,Ф/У г. КостромыФУ нижегородский обл.,ФУ нижегородский обл.С/У №278 города Санкт-петербурга И Ленинградской области,С/У №278 города Санкт-петербурга И Ленинградской областиФС Кабардино-балкарской республики,ФС Кабардино-балкарской республикиДзержинский межрайонный суд чукотского автономного округа,Дзержинским межрайонным судом чукотского автономного округаКизильский город суд КК,Кизильским городским судом ККЧерекский м-ый суд г. Ульяновска,Черекским м-ым судом г. УльяновскаКизнерский районный суд Санкт-петербурга,Кизнерским районным судом Санкт-петербургаМССУ №223 г. Новокузнецка,МССУ №223 г. НовокузнецкаСуджанский городской суд Белгородской обл.,Суджанским городским судом Белгородской обл.Золотухинский областной суд города Волгоград,Золотухинским областным судом города ВолгоградМС СУ №120 Пензенской области,МС СУ №120 Пензенской областиАрхангельский апелляционный суд г. Волгограда,Архангельским апелляционным судом г. ВолгоградаПодольский м-ый суд города Санкт-петербурга,Подольским м-ым судом города Санкт-петербургаМССУ №297 Ростовской области,МССУ №297 Ростовской областиШахтинский городской суд г. Каменск-уральского,Шахтинским городским судом г. Каменск-уральскогоОстровский областной суд города Саратова,Островским областным судом города СаратоваСапожковский р-ый суд г. СПБ,Сапожковским р-ым судом г. СПБНовоаннинский апелляционный суд г. Иркутска,Новоаннинским апелляционным судом г. ИркутскаУсольский город. суд Курской области,Усольским городским судом Курской областиЗольский межрайонный суд республики Алтай,Зольским межрайонным судом республики АлтайМС СУ №172 Магаданской области,МС СУ №172 Магаданской областиЛесозаводский военный суд г. Твери,Лесозаводским военным судом г. ТвериНово-савиновский р-ый суд приморского края,Ново-савиновским р-ым судом приморского краяСудебный участок №233 немецкого национального района,Судебным участком №233 немецкого национального районаВохомский город суд г. Санкт-петербурга,Вохомским городским судом г. Санкт-петербургаСУ №13 города Твери Тверской области,СУ №13 города Твери Тверской областиДавлекановский апелляционный суд г. нижний тагил,Давлекановским апелляционным судом г. нижний тагилБыстроистокский областной суд нижегородский обл.,Быстроистокским областным судом нижегородский обл.МС респ.крым,МС респ.крымКизлярский военный суд Иркутской области,Кизлярским военным судом Иркутской областиСарапульский м-ый суд Ростовской обл.,Сарапульским м-ым судом Ростовской обл.ФС Новосибирской области,ФС Новосибирской областиФ/С РБ,Ф/С РБТегульдетский городской суд Чеченской республики,Тегульдетским городским судом Чеченской республикиУсть-удинский межрайонный суд г. Балахна,Усть-удинским межрайонным судом г. БалахнаСыктывдинский м-ый суд Томской области,Сыктывдинским м-ым судом Томской областиТашлинский город. суд г. Махачкалы,Ташлинским городским судом г. МахачкалыБратский апелляционный суд г. Симферополя,Братским апелляционным судом г. СимферополяМ/С Челябинской области,М/С Челябинской областиОдоевский областной суд Кемеровской области,Одоевским областным судом Кемеровской областиСУ №73 респ.крым,СУ №73 респ.крымТрусовский районный суд города Санкт-петербурга И Ленинградской области,Трусовским районным судом города Санкт-петербурга И Ленинградской областиСызранский областной суд Иркутской области,Сызранским областным судом Иркутской областиКачканарский военный суд республики Саха,Качканарским военным судом республики СахаА/С г. Воронежа,А/С г. ВоронежаФедеральный суд респ.башкортостан,Федеральным судом респ.башкортостанНюксенский кассационный суд ханты-мансийского автономного округа - югры,Нюксенским кассационным судом ханты-мансийского автономного округа - югрыНовичихинский военный суд Воронежской области,Новичихинским военным судом Воронежской областиВолчихинский город суд г. Анапа,Волчихинским городским судом г. АнапаАрзгирский апелляционный суд ставропольский край,Арзгирским апелляционным судом ставропольский крайСысольский районный суд Калужской области,Сысольским районным судом Калужской областиМС СУ №226 Калининградской области,МС СУ №226 Калининградской областиФедеральный участок ставропольского края,Федеральным участком ставропольского краяУрванский кассационный суд Кировской области,Урванским кассационным судом Кировской областиУсманский р-ый суд г. Владимира,Усманским р-ым судом г. ВладимираСерышевский городской суд г. Чебоксары,Серышевским городским судом г. ЧебоксарыКалининградский м-ый суд города н.новгорода,Калининградским м-ым судом города н.новгородаВичугский военный суд города Твери Тверской области,Вичугским военным судом города Твери Тверской областиАС города Екатеринбурга Свердловской области,АС города Екатеринбурга Свердловской областиАрбитражный суд Рязанской области,Арбитражным судом Рязанской областиНогинский районный суд г. Санкт-петербурга,Ногинским районным судом г. Санкт-петербургаСУ №98 г. Калининграда,СУ №98 г. КалининградаФС г. Тольятти,ФС г. ТольяттиФ/У г. Тюмени,Ф/У г. ТюмениКалганский город. суд краснодарского края,Калганским городским судом краснодарского краяФУ г. Тулы,ФУ г. ТулыСоветский районный суд чувашской респ.,Советским районным судом чувашской респ.С/У №289 Орловской области,С/У №289 Орловской областиПачелмский военный суд Севастополя,Пачелмским военным судом СевастополяМировой суд немецкого национального района,Мировым судом немецкого национального районаФедеральный суд г. Самары,Федеральным судом г. СамарыИсилькульский городской суд г. Симферополя,Исилькульским городским судом г. СимферополяСудебный участок №172 ханты-мансийского автономного округа - югры,Судебным участком №172 ханты-мансийского автономного округа - югрыМировой суд г. Комсомольска-на-амуре,Мировым судом г. Комсомольска-на-амуреСобинский город суд города Волгоград,Собинским городским судом города ВолгоградАктанышский р-ый суд республика Коми,Актанышским р-ым судом республика КомиЛямбирский город суд ханты-мансийского автономного округа - югры,Лямбирским городским судом ханты-мансийского автономного округа - югрыСолнцевский кассационный суд г. Владивостока,Солнцевским кассационным судом г. ВладивостокаБлагодарненский областной суд республики Северная осетия-алания,Благодарненским областным судом республики Северная осетия-аланияА/С российской федерации,А/С российской федерацииФ/У республики Марий ЭЛ,Ф/У республики Марий ЭЛИшимский межрайонный суд ямало-ненецкого автономного округа,Ишимским межрайонным судом ямало-ненецкого автономного округаФС МО,ФС МОФС Саратовской области,ФС Саратовской областиБасманный областной суд города н.новгород,Басманным областным судом города н.новгородФ/У Новгородской области,Ф/У Новгородской областиСудогодский город суд республики Коми,Судогодским городским судом республики КомиФедеральный суд поволжского округа,Федеральным судом поволжского округаФ/У РТ,Ф/У РТАС г. нижний новгород,АС г. нижний новгородФУ Московской области,ФУ Московской областиПреображенский межрайонный суд г. Читы,Преображенским межрайонным судом г. ЧитыФС пермского края,ФС пермского краяАрбитражный суд г. Иваново,Арбитражным судом г. ИвановоСлюдянский военный суд Челябинской области,Слюдянским военным судом Челябинской областиВоркутинский апелляционный суд г. Москвы,Воркутинским апелляционным судом г. МосквыТотемский военный суд рсо-алания,Тотемским военным судом рсо-аланияМировой суд ХБ,Мировым судом ХБТогучинский м-ый суд чувашской респ.,Тогучинским м-ым судом чувашской респ.Коломенский город. суд г. Челябинска,Коломенским городским судом г. ЧелябинскаКетовский город. суд общей юрисдикции,Кетовским городским судом общей юрисдикцииКуйбышевский межрайонный суд алтайского края,Куйбышевским межрайонным судом алтайского краяАрбитражный суд г. Волгограда,Арбитражным судом г. ВолгоградаА/С Самарской области,А/С Самарской областиАС г. Саратова,АС г. СаратоваМССУ №88 Ростовской обл.,МССУ №88 Ростовской обл.СУ №7 Тверской области,СУ №7 Тверской областиМС г. Кирова,МС г. КироваЛазаревский м-ый суд г. Екатеринбурга,Лазаревским м-ым судом г. ЕкатеринбургаТере-хольский м-ый суд приморского края,Тере-хольским м-ым судом приморского краяФедеральный участок г. Чебоксары,Федеральным участком г. ЧебоксарыКассационный кассационный суд Амурской области,Кассационным кассационным судом Амурской областиРудничный апелляционный суд Иркутской области,Рудничным апелляционным судом Иркутской областиВеденский районный суд немецкого национального района,Веденским районным судом немецкого национального районаСУ №98 города Волгоград,СУ №98 города ВолгоградФедеральный участок города Тольятти Самарской обл.,Федеральным участком города Тольятти Самарской обл.СУ №136 забайкальского края,СУ №136 забайкальского краяТимский город суд Карачаево-черкесской республики,Тимским городским судом Карачаево-черкесской республикиА/С г. Красноярска,А/С г. КрасноярскаЧернский областной суд г. УФЫ,Чернским областным судом г. УФЫС/У №222 города Твери Тверской области,С/У №222 города Твери Тверской областиФС г. Ярославля,ФС г. ЯрославляМС СУ №140 г. Костромы,МС СУ №140 г. КостромыХолмогорский р-ый суд города Азов,Холмогорским р-ым судом города АзовС/У №264 Тюменской области,С/У №264 Тюменской областиС/У №237 г. Ставрополя,С/У №237 г. СтаврополяНижегородский город суд г. Ижевска,Нижегородским городским судом г. ИжевскаФедеральный суд г. СПБ И ЛО,Федеральным судом г. СПБ И ЛОАрбитражный суд г. Калининграда,Арбитражным судом г. КалининградаФедеральный суд Новгородской области,Федеральным судом Новгородской областиФедеральный участок Тамбовской области,Федеральным участком Тамбовской областиС/У №28 красноярского КР.,С/У №28 красноярского КР.Рассказовский областной суд г. СПБ И ЛО,Рассказовским областным судом г. СПБ И ЛОАрзамасский городской суд Саратовской области,Арзамасским городским судом Саратовской областиКантемировский кассационный суд Рязанской области,Кантемировским кассационным судом Рязанской областиАлапаевский апелляционный суд республики Крым,Алапаевским апелляционным судом республики КрымГусиноозерский военный суд г. Грозного,Гусиноозёрским военным судом г. ГрозногоФедеральный суд ХБ,Федеральным судом ХБСУ №295 Кемеровской области,СУ №295 Кемеровской областиКизилюртовский город суд г Санкт-петербурга,Кизилюртовским городским судом г Санкт-петербургаМатвеево-курганский военный суд РМЭ,Матвеево-курганским военным судом РМЭСудебный участок №15 Белгородской обл.,Судебным участком №15 Белгородской обл.Малопургинский р-ый суд Волгоградской обл.,Малопургинским р-ым судом Волгоградской обл.Мировой суд Воронежской обл.,Мировым судом Воронежской обл.Уренский город суд г. дагестанские огни,Уренским городским судом г. дагестанские огниМ/С хабаровского края,М/С хабаровского краяТомаринский город суд Ростовской обл.,Томаринским городским судом Ростовской обл.М/С немецкого национального района,М/С немецкого национального районаС/У №203 КК,С/У №203 ККФУ г. Ульяновска,ФУ г. УльяновскаМС краснодарского края,МС краснодарского краяА/С ставропольский край,А/С ставропольский крайМССУ №162 г. Смоленска,МССУ №162 г. СмоленскаФедеральный суд республики Северная осетия-алания,Федеральным судом республики Северная осетия-аланияЛодейнопольский районный суд г. Новокузнецка,Лодейнопольским районным судом г. НовокузнецкаСолонешенский военный суд г. Калининграда,Солонешенским военным судом г. КалининградаФ/С Воронежской обл.,Ф/С Воронежской обл.Мотыгинский м-ый суд республики Ингушетия,Мотыгинским м-ым судом республики ИнгушетияФ/У города Екатеринбурга Свердловской области,Ф/У города Екатеринбурга Свердловской областиФедеральный суд алтайского края,Федеральным судом алтайского краяШатковский апелляционный суд г. Волгограда,Шатковским апелляционным судом г. ВолгоградаАС г. Липецка,АС г. ЛипецкаФедеральный участок Воронежской обл.,Федеральным участком Воронежской обл.Новосибирский апелляционный суд г. Самары,Новосибирским апелляционным судом г. СамарыДивеевский город суд Вологодской области,Дивеевским городским судом Вологодской областиМировой суд г. Архангельска,Мировым судом г. АрхангельскаС/У №38 республики Калмыкия,С/У №38 республики КалмыкияПлесецкий апелляционный суд г. Тамбова,Плесецким апелляционным судом г. ТамбоваСергачский апелляционный суд г. Ставрополя,Сергачским апелляционным судом г. СтаврополяНаровчатский город. суд г. Тулы,Наровчатским городским судом г. ТулыСудебный участок №127 Самарской обл.,Судебным участком №127 Самарской обл.ФУ республики Адыгеи,ФУ республики Адыгеи