lawer,lawer_tpатяшевский мый суд хабаровского края,атяшевским мым судом хабаровского краямировой суд г екатеринбурга свердловской области,мировым судом г екатеринбурга свердловской областиеткульский рый суд города твери тверской области,еткульским рым судом города твери тверской областимссу 125 города нновгород,мссу 125 города нновгородас г москвы,ас г москвысухобузимский межрайонный суд города комсомольсканаамуре хабаровского края,сухобузимским межрайонным судом города комсомольсканаамуре хабаровского краямс су 298 новгородской области,мс су 298 новгородской областису 105 города саратова,су 105 города саратовабежаницкий рый суд поволжского округа,бежаницким рым судом поволжского округамс су 13 красноярского края,мс су 13 красноярского краяас тверской области,ас тверской областиас г краснодара,ас г краснодарафу г тольятти,фу г тольяттишебалинский городской суд волгоградской обл,шебалинским городским судом волгоградской облас алтайского края,ас алтайского краяарбитражный суд города тольятти самарской обл,арбитражным судом города тольятти самарской облтихорецкий военный суд города саратова,тихорецким военным судом города саратовамс г владикавказа,мс г владикавказасудебный участок 251 г ставрополя,судебным участком 251 г ставрополямс су 188 г ульяновска,мс су 188 г ульяновскамс г санктпетербурга и ло,мс г санктпетербурга и лофс города екатеринбурга свердловской области,фс города екатеринбурга свердловской областисудебный участок 13 г владивостока,судебным участком 13 г владивостоказаводский город суд г магнитогорска,заводским городским судом г магнитогорскаас санктпетербурга,ас санктпетербургасу 203 сахалинской области,су 203 сахалинской областисудебный участок 161 г тюмени,судебным участком 161 г тюмениирбейский рый суд города нижний тагил свердловской области,ирбейским рым судом города нижний тагил свердловской областиас города тольятти,ас города тольяттирусскополянский город суд еврейской автономной области,русскополянским городским судом еврейской автономной областимс г севастополя,мс г севастополяхолмогорский рый суд кабардинобалкарской республики,холмогорским рым судом кабардинобалкарской республикитроицкопечорский рый суд воронежской области,троицкопечорским рым судом воронежской областисудебный участок 261 тамбовской области,судебным участком 261 тамбовской областиарбитражный суд рсоалания,арбитражным судом рсоаланияас г тулы,ас г тулыбижбулякский рый суд г нижний тагил,бижбулякским рым судом г нижний тагилмагасский город суд г грозного,магасским городским судом г грозногосапожковский городской суд орловской области,сапожковским городским судом орловской областипривокзальный город суд алтайского края,привокзальным городским судом алтайского краясу 188 красноярского кр,су 188 красноярского крас г липецка,ас г липецкасампурский город суд г курска,сампурским городским судом г курсканаурский межрайонный суд свердловская область,наурскием межрайонным судом свердловская областьзаларинский военный суд республики дагестана,заларинским военным судом республики дагестанаянаульский апелляционный суд республики мордовия,янаульским апелляционным судом республики мордовияачинский межрайонный суд забайкальского края,ачинским межрайонным судом забайкальского краязаречный городской суд тамбовской области,заречным городским судом тамбовской областису 13 ямалоненецкого автономного округа,су 13 ямалоненецкого автономного округаоловяннинский город суд удмуртской республики,оловяннинским городским судом удмуртской республикиарбитражный суд г хабаровска,арбитражным судом г хабаровскаистринский город суд новосибирской обл,истринским городским судом новосибирской облмссу 61 г нижний новгород,мссу 61 г нижний новгородизбербашский мый суд города севастополя,избербашским мым судом города севастополяарбитражный суд г новороссийска,арбитражным судом г новороссийскасерпуховский городской суд свердловская область,серпуховским городским судом свердловская областьсу 174 г ставрополя,су 174 г ставрополяфс г новороссийска,фс г новороссийскамаксатихинский военный суд г орска,максатихинским военным судом г орскавеликолукский апелляционный суд ульяновской области,великолукским апелляционным судом ульяновской областифс липецкой области,фс липецкой областиродинский городской суд г кирова,родинским городским судом г кироваас мо,ас моарбитражный суд г тюмени,арбитражным судом г тюмениас ярославской области,ас ярославской областису 48 г казани,су 48 г казаниидринский рый суд республики татарстан,идринским рым судом республики татарстанясногорский кассационный суд г санктпетербурга,ясногорским кассационным судом г санктпетербургасу 210 рт,су 210 ртиглинский апелляционный суд республики саха якутия,иглинским апелляционным судом республики саха якутиякалязинский городской суд волгоградской области,калязинским городским судом волгоградской областифедеральный суд г тольятти,федеральным судом г тольяттибольшереченский рый суд республики бурятия,большереченским рым судом республики бурятияас немецкого национального района,ас немецкого национального районамс г комсомольсканаамуре,мс г комсомольсканаамуреприонежский военный суд г перми,прионежским военным судом г пермисармановский городской суд ур,сармановским городским судом уртомаринский межрайонный суд томской области,томаринским межрайонным судом томской областидюртюлинский город суд мурманской области,дюртюлинским городским судом мурманской областимс города тольятти,мс города тольяттичишминский город суд г новороссийска,чишминским городским судом г новороссийскаарбитражный суд г новосибирска,арбитражным судом г новосибирскавыксунский кассационный суд города тольятти самарской области,выксунским кассационным судом города тольятти самарской областидмитровский межрайонный суд г новосибирска,дмитровским межрайонным судом г новосибирскароссошанский районный суд нижегородской области,россошанским районным судом нижегородской областимссу 194 г рязани,мссу 194 г рязанировеньский городской суд г воронежа,ровеньским городским судом г воронежасудебный участок 108 мо,судебным участком 108 мофс г спб и ло,фс г спб и ломс города москвы,мс города москвыарбитражный суд республики тыва,арбитражным судом республики тываарбитражный суд г брянска,арбитражным судом г брянскамс республики татарстан,мс республики татарстансоветскогаванский районный суд г дагестанские огни,советскогаванским районным судом г дагестанские огнимурашинский город суд республики алтай,мурашинским городским судом республики алтайфедеральный суд г читы,федеральным судом г читыисакогорский военный суд оренбургской области,исакогорским военным судом оренбургской областиборисоглебский рый суд московского округа,борисоглебским рым судом московского округамировой суд г владикавказа,мировым судом г владикавказафс костромской области,фс костромской областифс города нижний новгород,фс города нижний новгородмс свердловской области,мс свердловской областиас города санктпетербурга и ленинградской области,ас города санктпетербурга и ленинградской областитындинский кассационный суд г севастополя,тындинским кассационным судом г севастополяметаллургический апелляционный суд поволжского округа,металлургическим апелляционным судом поволжского округарадужнинский рый суд калужской области,радужнинским рым судом калужской областияшкинский областной суд хб,яшкинским областным судом хбсуздальский городской суд города саратова,суздальским городским судом города саратовафу республика коми,фу республика комичерлакский межрайонный суд хантымансийского автономного округа югры,черлакским межрайонным судом хантымансийского автономного округа югрыкрасносулинский районный суд белгородской обл,красносулинским районным судом белгородской облфс г севастополя,фс г севастополясу 270 калужской области,су 270 калужской областису 192 свердловской области,су 192 свердловской областинововаршавский рый суд г грозного,нововаршавским рым судом г грозногомс свердловская область,мс свердловская областьсудебный участок 218 орловской области,судебным участком 218 орловской областисуворовский военный суд нижегородский обл,суворовским военным судом нижегородский облсу 207 рб,су 207 рбсу 16 ивановской области,су 16 ивановской областитигильский рый суд г волгоград,тигильским рым судом г волгоградингодинский мый суд калининградской области,ингодинским мым судом калининградской областиарбитражный суд мо,арбитражным судом мофедеральный участок г оренбурга,федеральным участком г оренбургановодвинский городской суд г балахна,новодвинским городским судом г балахнафедеральный участок респхакасия,федеральным участком респхакасиямс респмордовия,мс респмордовияфедеральный суд города абакан,федеральным судом города абаканеманжелинский областной суд тверской области,еманжелинским областным судом тверской областивязниковский кассационный суд г воронежа,вязниковским кассационным судом г воронежапролетарский город суд рб,пролетарским городским судом рбарбитражный суд еао,арбитражным судом еаокалганский военный суд г омска,калганским военным судом г омсказвениговский мый суд г спб и ло,звениговским мым судом г спб и ловельский военный суд г омска,вельским военным судом г омскачерекский апелляционный суд хантымансийского автономного округа югры,черекским апелляционным судом хантымансийского автономного округа югрыканский военный суд республики татарстан,канским военным судом республики татарстанребрихинский город суд тамбовской области,ребрихинским городским судом тамбовской областигагаринский город суд хб,гагаринским городским судом хбмосковский городской суд республики крым,московским городским судом республики крымфедеральный участок ивановской области,федеральным участком ивановской областисудебный участок 133 города санктпетербурга,судебным участком 133 города санктпетербургаступинский мый суд волгоградской обл,ступинским мым судом волгоградской облкаслинский военный суд республики марий эл,каслинским военным судом республики марий элсосновский апелляционный суд г екатеринбурга,сосновским апелляционным судом г екатеринбургасысольский город суд респхакасия,сысольским городским судом респхакасияфу г кемерово,фу г кемеровоас г екатеринбурга,ас г екатеринбургамс города санктпетербург,мс города санктпетербургкавказский город суд города екатеринбурга свердловской области,кавказским городским судом города екатеринбурга свердловской областиовюрский мый суд г ульяновска,овюрским мым судом г ульяновскапрохоровский межрайонный суд г уфы,прохоровским межрайонным судом г уфыспасский городской суд г москвы,спасским городским судом г москвыфс г белгорода,фс г белгородасу 112 поволжского округа,су 112 поволжского округадульдургинский военный суд камчатского края,дульдургинским военным судом камчатского краясудебный участок 51 г читы,судебным участком 51 г читыас нижегородской области,ас нижегородской областипронский областной суд республики тыва,пронским областным судом республики тывамировой суд г краснодара,мировым судом г краснодаранавашинский город суд г анапа,навашинским городским судом г анапатретьяковский кассационный суд ростовской области,третьяковским кассационным судом ростовской областифс республики бурятия,фс республики бурятиямс республики ингушетия,мс республики ингушетияновочеркасский городской суд тюменской области,новочеркасским городским судом тюменской областифс г тамбова,фс г тамбовановочебоксарский военный суд калининградской области,новочебоксарским военным судом калининградской областикатавивановский районный суд города каменскуральского свердловской области,катавивановским районным судом города каменскуральского свердловской областибратский кассационный суд города санктпетербурга,братским кассационным судом города санктпетербургаустьбольшерецкий кассационный суд республики башкортостан,устьбольшерецким кассационным судом республики башкортостансу 289 г махачкалы,су 289 г махачкалыцелинский областной суд московского округа,целинским областным судом московского округаапшеронский межрайонный суд г перми,апшеронским межрайонным судом г перминовоуральский рый суд г омска,новоуральским рым судом г омскаверхневилюйский межрайонный суд республики марий эл,верхневилюйским межрайонным судом республики марий элсу 110 г сочи,су 110 г сочишурышкарский город суд нижегородской области,шурышкарским городским судом нижегородской областимс г перми,мс г пермисобинский городской суд воронежской обл,собинским городским судом воронежской обласбестовский город суд города москвы,асбестовским городским судом города москвынурлатский мый суд вологодской области,нурлатским мым судом вологодской областифу ростовской области,фу ростовской областиизобильненский город суд г курска,изобильненским городским судом г курскакаларский военный суд тамбовской области,каларским военным судом тамбовской областилоухский кассационный суд города саратова,лоухским кассационным судом города саратовафедеральный суд г абакан,федеральным судом г абаканкаспийский город суд московского округа,каспийским городским судом московского округаас г хабаровска,ас г хабаровскафс г новороссийска,фс г новороссийскамс г ростованадону,мс г ростованадонуас респбашкортостан,ас респбашкортостанпервый город суд тульской области,первым городским судом тульской областифедеральный суд города санктпетербурга и ло,федеральным судом города санктпетербурга и лосу 209 тамбовской области,су 209 тамбовской областилямбирский кассационный суд курской области,лямбирским кассационным судом курской областиневский город суд мо,невским городским судом мокаякентский рый суд вологодской области,каякентским рым судом вологодской областисергиевский областной суд г курска,сергиевским областным судом г курскамс пермского края,мс пермского краякирилловский апелляционный суд курганской области,кирилловским апелляционным судом курганской областикировградский городской суд г нижний новгород,кировградским городским судом г нижний новгородмс города сочи краснодарского края,мс города сочи краснодарского края