lawer,lawer_tpмценский город суд города каменскуральского свердловской области,мценским городским судом города каменскуральского свердловской областиснежинский межрайонный суд нижегородская обл,снежинским межрайонным судом нижегородская облбокситогорский районный суд нижегородский обл,бокситогорским районным судом нижегородский облкабанский город суд ульяновской области,кабанским городским судом ульяновской областифу города каменскуральского свердловской области,фу города каменскуральского свердловской областипластский апелляционный суд г краснодара,пластским апелляционным судом г краснодарасудакский апелляционный суд новосибирской области,судакским апелляционным судом новосибирской областиковдорский межрайонный суд г сыктывкара,ковдорским межрайонным судом г сыктывкараарбитражный суд города твери тверской области,арбитражным судом города твери тверской областикологривский мый суд г нижний новгород,кологривским мым судом г нижний новгородбазарнокарабулакский рый суд тюменской области,базарнокарабулакским рым судом тюменской областииссинский апелляционный суд г сыктывкара,иссинским апелляционным судом г сыктывкаратимирязевский город суд республики дагестана,тимирязевским городским судом республики дагестанаверхнеколымский городской суд тверской области,верхнеколымским городским судом тверской областифу чувашской респ,фу чувашской респалтайский городской суд города нижний тагил свердловской области,алтайским городским судом города нижний тагил свердловской областичеремховский военный суд респмордовия,черемховским военным судом респмордовияас города тольятти,ас города тольяттивяземский мый суд г лесного,вяземским мым судом г лесногосунтарский апелляционный суд г самары,сунтарским апелляционным судом г самарыакеайский межрайонный суд хб,акеайским межрайонным судом хбмировой суд ульяновской области,мировым судом ульяновской областифедеральный суд г тюмени,федеральным судом г тюмениполярный районный суд г челябинска,полярным районным судом г челябинскафу республики марий эл,фу республики марий элас республики адыгея,ас республики адыгеялабинский апелляционный суд белгородской обл,лабинским апелляционным судом белгородской облсуджанский апелляционный суд ульяновской области,суджанским апелляционным судом ульяновской областикиржачский рый суд псковской области,киржачским рым судом псковской областикалтанский военный суд республики саха якутия,калтанским военным судом республики саха якутияас респмордовия,ас респмордовияволховский межрайонный суд г уфы,волховским межрайонным судом г уфыфс г комсомольсканаамуре,фс г комсомольсканаамурекарпинский военный суд краснодарского края,карпинским военным судом краснодарского краямегионский апелляционный суд г калининграда,мегионским апелляционным судом г калининградакурганинский районный суд г екатеринбурга,курганинским районным судом г екатеринбургамс республики мордовия,мс республики мордовияас свердловская область,ас свердловская областьсудебный участок 150 г волгоград,судебным участком 150 г волгоградсу 272 немецкого национального района,су 272 немецкого национального районаарбитражный суд г орска,арбитражным судом г орскакисловодский кассационный суд республики дагестан,кисловодским кассационным судом республики дагестануваровский военный суд кк,уваровским военным судом ккзольский районный суд города казани,зольским районным судом города казанифедеральный суд города нижний тагил свердловской области,федеральным судом города нижний тагил свердловской областигубкинский межрайонный суд города абакан,губкинским межрайонным судом города абаканфу республики коми,фу республики комигрибановский мый суд города комсомольсканаамуре хабаровского края,грибановским мым судом города комсомольсканаамуре хабаровского краямс су 161 немецкого национального района,мс су 161 немецкого национального районамс еврейской автономной области,мс еврейской автономной областимссу 189 г каменскуральского,мссу 189 г каменскуральскогосмирныховский город суд кемеровской области,смирныховским городским судом кемеровской областиконышевский межрайонный суд чувашской республики,конышевским межрайонным судом чувашской республикипуровский военный суд г махачкалы,пуровским военным судом г махачкалыновоаннинский районный суд г ростованадону,новоаннинским районным судом г ростованадонуртищевский город суд г саранска,ртищевским городским судом г саранскамелекесский районный суд респтатарстан,мелекесским районным судом респтатарстанарбитражный суд ставропольского края,арбитражным судом ставропольского краяфедеральный суд г нижний тагил,федеральным судом г нижний тагилмс г пензы,мс г пензыас г читы,ас г читыприаргунский военный суд г орла,приаргунским военным судом г орлатазовский апелляционный суд г благовещенск,тазовским апелляционным судом г благовещенскнефтекумский областной суд свердловской области,нефтекумским областным судом свердловской областимс омской области,мс омской областиас оренбургской области,ас оренбургской областинижегородский апелляционный суд псковской области,нижегородским апелляционным судом псковской областисуражский районный суд рб,суражским районным судом рбволгодонской межрайонный суд западносибирского округа,волгодонским межрайонным судом западносибирского округамировой суд г екатеринбурга,мировым судом г екатеринбургаас города комсомольсканаамуре хабаровского края,ас города комсомольсканаамуре хабаровского краясу 129 города екатеринбурга свердловской области,су 129 города екатеринбурга свердловской областичистопольский город суд г новосибирска,чистопольским городским судом г новосибирскабессоновский город суд республики коми,бессоновским городским судом республики коминовомосковский военный суд республики ингушетия,новомосковским военным судом республики ингушетияфу брянской области,фу брянской областибелозерский военный суд рмэ,белозерским военным судом рмэвоскресенский город суд курской области,воскресенским городским судом курской областитарумовский городской суд свердловской области,тарумовским городским судом свердловской областиирбитский межрайонный суд г нижний новгород,ирбитским межрайонным судом г нижний новгородбабушкинский город суд города сочи краснодарского края,бабушкинским городским судом города сочи краснодарского краяславянский межрайонный суд города сочи,славянским межрайонным судом города сочикобяйский мый суд санктпетербурга,кобяйским мым судом санктпетербургамс г ульяновска,мс г ульяновскаарбитражный суд свердловская область,арбитражным судом свердловская областьбыстроистокский городской суд кемеровской области,быстроистокским городским судом кемеровской областисевастопольский город суд забайкальского края,севастопольским городским судом забайкальского краясу 299 г каменскуральского,су 299 г каменскуральскогомс су 255 г ярославля,мс су 255 г ярославлямс г калининграда,мс г калининградаприморскоахтарский мый суд калужской области,приморскоахтарским мым судом калужской областиленский военный суд города севастополя,ленским военным судом города севастополяклетский город суд рсоалания,клетским городским судом рсоаланияневельский мый суд респмордовия,невельским мым судом респмордовиямссу 74 рт,мссу 74 ртфедеральный суд кировской области,федеральным судом кировской областифс новгородской области,фс новгородской областимссу 201 архангельской области,мссу 201 архангельской областифу липецкой области,фу липецкой областибашмаковский областной суд рязанской области,башмаковским областным судом рязанской областиазовский кассационный суд камчатского края,азовским кассационным судом камчатского краясмидовичский городской суд г уфы,смидовичским городским судом г уфыкошехабльский межрайонный суд г ульяновска,кошехабельским межрайонным судом г ульяновскамссу 83 вологодской области,мссу 83 вологодской областияранский городской суд г екатеринбурга,яранским городским судом г екатеринбургабельский городской суд магаданской области,бельским городским судом магаданской областисевероенисейский город суд г саратова,североенисейским городским судом г саратовафс кемеровской области,фс кемеровской областимс г новосибирска,мс г новосибирскатахтамукайский мый суд челябинской области,тахтамукайским мым судом челябинской областиялуторовский апелляционный суд города тольятти самарской обл,ялуторовским апелляционным судом города тольятти самарской облсу 227 г оренбурга,су 227 г оренбургафу г сыктывкара,фу г сыктывкарафедеральный суд псковской области,федеральным судом псковской областифс г уфы,фс г уфыноябрьский районный суд псковской области,ноябрьским районным судом псковской областичерноярский районный суд республики калмыкия,черноярским районным судом республики калмыкиякулундинский областной суд немецкого национального района,кулундинским областным судом немецкого национального районамакарьевский областной суд орловской области,макарьевским областным судом орловской областимагарамкентский мый суд г сыктывкара,магарамкентским мым судом г сыктывкарафс города абакан,фс города абаканмс нижегородской обл,мс нижегородской облжуковский военный суд г краснодара,жуковским военным судом г краснодарапанкрушихинский городской суд пензенской области,панкрушихинским городским судом пензенской областиас мурманской области,ас мурманской областимировой суд новосибирской обл,мировым судом новосибирской облфу г москвы,фу г москвыловозерский военный суд кабардинобалкарской республики,ловозерским военным судом кабардинобалкарской республикисямженский городской суд г спб и ло,сямженским городским судом г спб и лоульяновский районный суд республики бурятия,ульяновским районным судом республики бурятияфедеральный участок г хабаровска,федеральным участком г хабаровсканижнеомский межрайонный суд г курска,нижнеомским межрайонным судом г курскачаахольский городской суд г ижевска,чаахольским городским судом г ижевскастановлянский мый суд тульской области,становлянским мым судом тульской областимензелинский город суд г владивостока,мензелинским городским судом г владивостокатисульский апелляционный суд брянской области,тисульским апелляционным судом брянской областифс иркутской обл,фс иркутской облсу 230 пермского края,су 230 пермского краякаменский мый суд пермского края,каменским мым судом пермского краямировой суд г севастополя,мировым судом г севастополясебежский районный суд нижегородской обл,себежским районным судом нижегородской облфу белгородской обл,фу белгородской облкрасновишерский рый суд ивановской области,красновишерским рым судом ивановской областиарбитражный суд нижегородской области,арбитражным судом нижегородской областифс города москвы,фс города москвысудебный участок 67 г воронежа,судебным участком 67 г воронежаапелляционный рый суд ставропольского края,апелляционным рым судом ставропольского краяорловский городской суд республики тыва,орловским городским судом республики тывамс су 217 кк,мс су 217 ккмссу 220 г саратова,мссу 220 г саратовасу 286 хб,су 286 хбванинский город суд г саранска,ванинским городским судом г саранскафу г краснодара,фу г краснодарадолгопрудненский межрайонный суд г самары,долгопрудненским межрайонным судом г самарыкаргасокский город суд республики коми,каргасокским городским судом республики комифс рб,фс рбсу 142 липецкой области,су 142 липецкой областибольшемуртинский межрайонный суд г новокузнецка,большемуртинским межрайонным судом г новокузнецканеманский межрайонный суд cаратовской области,неманским межрайонным судом cаратовской областишатойский рый суд г саратова,шатойским рым судом г саратовановосокольнический кассационный суд архангельской области,новосокольническим кассационным судом архангельской областимс г архангельска,мс г архангельскабогородский рый суд красноярского края,богородским рым судом красноярского краямс г оренбурга,мс г оренбургальговский межрайонный суд г орска,льговским межрайонным судом г орскафедеральный суд вологодской области,федеральным судом вологодской областиухтинский городской суд пензенская об,ухтинским городским судом пензенская обкондопожский областной суд нижегородской области,кондопожским областным судом нижегородской областиромодановский городской суд г саратова,ромодановским городским судом г саратовабольшеулуйский апелляционный суд г брянска,большеулуйским апелляционным судом г брянсканальчикский город суд смоленской области,нальчикским городским судом смоленской областимышкинский город суд г архангельска,мышкинским городским судом г архангельскамс су 43 г благовещенск,мс су 43 г благовещенскшелопугинский кассационный суд г каменскуральского,шелопугинским кассационным судом г каменскуральскогозеленодольский город суд сахалинской области,зеленодольским городским судом сахалинской областиас г новосибирска,ас г новосибирскамировой суд города казань,мировым судом города казанькунцевский город суд пензенская обл,кунцевским городским судом пензенская облсосновоборский рый суд волгоградской обл,сосновоборским рым судом волгоградской облас магаданской области,ас магаданской областимировой суд ямалоненецкого автономного округа,мировым судом ямалоненецкого автономного округасу 68 республики коми,су 68 республики комиаркадакский город суд г магнитогорска,аркадакским городским судом г магнитогорскамссу 122 города севастополь,мссу 122 города севастопольковернинский город суд калужской области,ковернинским городским судом калужской областимс г лесного,мс г лесногофу г казани,фу г казанифедеральный участок хб,федеральным участком хбзалегощенский рый суд нижегородский обл,залегощенским рым судом нижегородский облас г ижевска,ас г ижевскафс г брянска,фс г брянскасу 213 г калининграда,су 213 г калининградаонгудайский рый суд г самары,онгудайским рым судом г самарышушенский город суд г ставрополя,шушенским городским судом г ставрополяас г нижний тагил,ас г нижний тагилстарорусский районный суд санктпетербурга,старорусским районным судом санктпетербургаас ставропольский край,ас ставропольский край