lawer,lawer_tpкандалакшский военный суд г казани,кандалакшским военным судом г казаникущевский кассационный суд кировской области,кущёвским кассационным судом кировской областивольский областной суд г лесного,вольским областным судом г лесноговологодский рый суд г махачкалы,вологодским рым судом г махачкалыуспенский апелляционный суд г спб,успенским апелляционным судом г спбсорский город суд нижегородской области,сорским городским судом нижегородской областифедеральный участок города севастополя,федеральным участком города севастополямс рб,мс рбкуменский областной суд рб,кумёнским областным судом рбкармаскалинский районный суд г ульяновска,кармаскалинским районным судом г ульяновскафу республики саха,фу республики сахановошешминский городской суд рсоалания,новошешминским городским судом рсоаланиякочевский областной суд г нижний новгород,кочевским областным судом г нижний новгородзаринский областной суд города тольятти самарской области,заринским областным судом города тольятти самарской областифу г комсомольсканаамуре,фу г комсомольсканаамуремссу 116 брянской области,мссу 116 брянской областиольгинский город суд г смоленска,ольгинским городским судом г смоленскадзунхемчикский мый суд брянской области,дзунхемчикским мым судом брянской областикимрский кассационный суд г сочи,кимрским кассационным судом г сочиартинский рый суд г братска,артинским рым судом г братскаусольский рый суд красноярского края,усольским рым судом красноярского краявилючинский районный суд еао,вилючинским районным судом еаофу республики северная осетияалания,фу республики северная осетияаланиямс города твери тверской области,мс города твери тверской областимировой суд севастополя,мировым судом севастополямс г липецка,мс г липецкавеневский апелляционный суд респбурятия,веневским апелляционным судом респбурятияфс города азов,фс города азовбугульминский город суд тульской области,бугульминским городским судом тульской областичеремисиновский город суд города санктпетербурга и ло,черемисиновским городским судом города санктпетербурга и логусевский мый суд еврейской автономной области,гусевским мым судом еврейской автономной областизаокский кассационный суд города нновгорода,заокским кассационным судом города нновгородакваркенский районный суд города севастополь,кваркенским районным судом города севастопольмс ур,мс урдновский город суд липецкой области,дновским городским судом липецкой областисудебный участок 136 сахалинской области,судебным участком 136 сахалинской областисудебный участок 176 города тольятти самарской обл,судебным участком 176 города тольятти самарской облозерский мый суд города твери тверской области,озёрским мым судом города твери тверской областиярославский город суд г белгорода,ярославским городским судом г белгородасудебный участок 121 республики бурятия,судебным участком 121 республики бурятиямончегорский город суд пензенская обл,мончегорским городским судом пензенская облсасовский областной суд кабардинобалкарской республики,сасовским областным судом кабардинобалкарской республикиивантеевский апелляционный суд города москвы,ивантеевским апелляционным судом города москвыас г тольятти,ас г тольяттибатыревский межрайонный суд ростовской области,батыревским межрайонным судом ростовской областиморозовский город суд г липецка,морозовским городским судом г липецкалодейнопольский городской суд чувашской республики,лодейнопольским городским судом чувашской республикимс г новороссийска,мс г новороссийскамихайловский рый суд приморского края,михайловским рым судом приморского краяфу города абакан,фу города абаканталицкий межрайонный суд западносибирского округа,талицким межрайонным судом западносибирского округарязанский городской суд рязанской области,рязанским городским судом рязанской областимс города каменскуральского свердловской области,мс города каменскуральского свердловской областимс су 41 г прокопьевска,мс су 41 г прокопьевскасуземский рый суд г абакан,суземским рым судом г абаканчердаклинский военный суд пензенская обл,чердаклинским военным судом пензенская облфу республики коми,фу республики комицелинный городской суд чувашской республики,целинным городским судом чувашской республикифедеральный суд г орска,федеральным судом г орскамолчановский межрайонный суд г сыктывкара,молчановским межрайонным судом г сыктывкараямальский рый суд г новокузнецка,ямальским рым судом г новокузнецкамс су 195 города сочи краснодарского края,мс су 195 города сочи краснодарского краяипатовский областной суд брянской области,ипатовским областным судом брянской областичаинский военный суд воронежской обл,чаинским военным судом воронежской облсудебный участок 173 республики северная осетияалания,судебным участком 173 республики северная осетияаланияфу ставропольского края,фу ставропольского краяфу города севастополя,фу города севастополякраснозерский районный суд новосибирской обл,краснозёрским районным судом новосибирской облмс новгородской области,мс новгородской областифедеральный суд ро,федеральным судом роилишевский рый суд респкрым,илишевским рым судом респкрыммишкинский межрайонный суд липецкой области,мишкинским межрайонным судом липецкой областипрохладненский городской суд новгородской области,прохладненским городским судом новгородской областисудебный участок 130 г уланудэ,судебным участком 130 г уланудэмс ярославской области,мс ярославской областифс брянской области,фс брянской областикореновский город суд респхакасия,кореновским городским судом респхакасиячановский апелляционный суд г магнитогорска,чановским апелляционным судом г магнитогорскамс воронежской области,мс воронежской областимс города нновгород,мс города нновгородсевероуральский рый суд респ башкортостан,североуральским рым судом респ башкортостандавлекановский районный суд республики башкортостан,давлекановским районным судом республики башкортостанмссу 225 челябинской области,мссу 225 челябинской областису 186 г спб,су 186 г спбфедеральный суд республики ингушетия,федеральным судом республики ингушетиямс г спб и ло,мс г спб и лощербиновский межрайонный суд города санктпетербург,щербиновским межрайонным судом города санктпетербургэнгельсский военный суд красноярского кр,энгельсским военным судом красноярского крас ульяновской области,ас ульяновской областифедеральный участок г краснодара,федеральным участком г краснодарашилкинский районный суд г ижевска,шилкинским районным судом г ижевскаруднянский кассационный суд г екатеринбурга,руднянским кассационным судом г екатеринбургафедеральный участок г ростованадону,федеральным участком г ростованадонуфс рмэ,фс рмэбелореченский рый суд города твери тверской области,белореченским рым судом города твери тверской областиарбитражный суд рязанской области,арбитражным судом рязанской областикраснокутский межрайонный суд г москвы,краснокутским межрайонным судом г москвытюхтетский мый суд поволжского округа,тюхтетским мым судом поволжского округакрасноселькупский районный суд г барнаула,красноселькупским районным судом г барнаулаарбитражный суд г самары,арбитражным судом г самарыгеоргиевский областной суд республики крым,георгиевским областным судом республики крымфу карачаевочеркесской республики,фу карачаевочеркесской республикисудебный участок 245 города нижний тагил свердловской области,судебным участком 245 города нижний тагил свердловской областихангаласский районный суд республики ингушетия,хангаласским районным судом республики ингушетиядесногорский районный суд города нижний тагил свердловской области,десногорским районным судом города нижний тагил свердловской областифс г лесного,фс г лесногомс города саратова,мс города саратовафедеральный суд г екатеринбурга,федеральным судом г екатеринбургамировой суд г перми,мировым судом г пермимс су 242 тульской области,мс су 242 тульской областибуйский город суд респбашкортостан,буйским городским судом респбашкортостансу 180 краснодарского края,су 180 краснодарского краямс тверской области,мс тверской областисарапульский межрайонный суд г курска,сарапульским межрайонным судом г курскабалтасинский районный суд города нновгорода,балтасинским районным судом города нновгородамуромский военный суд магаданской области,муромским военным судом магаданской областикрасносельский межрайонный суд республики адыгея,красносельским межрайонным судом республики адыгеябелорецкий город суд г кирова,белорецким городским судом г кироваас ро,ас ромс города абакан,мс города абаканмссу 146 города казань,мссу 146 города казаньшовгеновский кассационный суд г саранска,шовгеновским кассационным судом г саранскагороховецкий городской суд г смоленска,гороховецким городским судом г смоленсканогликский город суд мурманской области,ногликским городским судом мурманской областифс г барнаула,фс г барнаулафедеральный участок мурманской области,федеральным участком мурманской областивыселковский городской суд города тольятти,выселковским городским судом города тольяттикраснооктябрьский город суд города казани,краснооктябрьским городским судом города казаниверхнеуральский апелляционный суд г казани,верхнеуральским апелляционным судом г казанифу респбурятия,фу респбурятияшарлыкский областной суд города каменскуральского свердловской области,шарлыкским областным судом города каменскуральского свердловской областинаримановский военный суд г челябинска,наримановским военным судом г челябинскасунженский город суд респ башкортостан,сунженским городским судом респ башкортостансу 119 иркутской обл,су 119 иркутской облтопчихинский военный суд города казани,топчихинским военным судом города казаниобливский областной суд оренбургской области,обливским областным судом оренбургской областимссу 209 г комсомольсканаамуре,мссу 209 г комсомольсканаамуремс г ярославля,мс г ярославлясудебный участок 52 республики крым,судебным участком 52 республики крымтегульдетский кассационный суд иркутской области,тегульдетским кассационным судом иркутской областимссу 173 карачаевочеркесской республики,мссу 173 карачаевочеркесской республикимс су 226 саратовской области,мс су 226 саратовской областифедеральный суд города севастополь,федеральным судом города севастопольлюбимский районный суд кк,любимским районным судом ккбелевский рый суд ростовской обл,белёвским рым судом ростовской облключевский районный суд г томска,ключевским районным судом г томскаурайский город суд г самары,урайским городским судом г самарыновохоперский областной суд города саратова,новохопёрским областным судом города саратовамс г рязани,мс г рязанииволгинский городской суд рмэ,иволгинским городским судом рмэотрадненский город суд города абакан,отрадненским городским судом города абаканфу г нижний тагил,фу г нижний тагилфу города санктпетербург и ленинградской области,фу города санктпетербург и ленинградской областикочубеевский город суд хб,кочубеевским городским судом хбгурьевский областной суд курской области,гурьевским областным судом курской областифедеральный суд города сочи,федеральным судом города сочибеловский городской суд республики адыгеи,беловским городским судом республики адыгеикраснодарский рый суд еао,краснодарским рым судом еаопачелмский районный суд воронежской обл,пачелмским районным судом воронежской облмс г новосибирска,мс г новосибирскапятый кассационный суд ленинградской области,пятым кассационным судом ленинградской областиас общей юрисдикции,ас общей юрисдикциисудебный участок 12 красноярского кр,судебным участком 12 красноярского крас города казани,ас города казанимссу 20 московской области,мссу 20 московской областимуравленковский районный суд архангельской области,муравленковским районным судом архангельской областимс города нижний тагил свердловской области,мс города нижний тагил свердловской областидомодедовский городской суд г саратова,домодедовским городским судом г саратоваас вологодской области,ас вологодской областиприозерский военный суд города казань,приозерским военным судом города казаньтарногский город суд г ростованадону,тарногским городским судом г ростованадонуас г калининграда,ас г калининградасоликамский районный суд г твери,соликамским районным судом г тверикавалеровский межрайонный суд рсоалания,кавалеровским межрайонным судом рсоаланияфу оренбургской области,фу оренбургской областикарагинский мый суд г санктпетербурга,карагинским мым судом г санктпетербургафедеральный суд ставропольский край,федеральным судом ставропольский крайфу кк,фу ккужурский рый суд самарской области,ужурским рым судом самарской областиарзгирский город суд г ульяновска,арзгирским городским судом г ульяновскамс су 79 города санктпетербурга,мс су 79 города санктпетербургахилокский кассационный суд мурманской области,хилокским кассационным судом мурманской областитетюшский межрайонный суд республики башкортостан,тетюшским межрайонным судом республики башкортостанкромской город суд республики адыгеи,кромским городским судом республики адыгеиуссурийский межрайонный суд города нновгород,уссурийским межрайонным судом города нновгородас города нновгород,ас города нновгородфу республики марий эл,фу республики марий элас г анапа,ас г анапакоченевский городской суд г благовещенск,коченевским городским судом г благовещенскарбитражный суд республики ингушетия,арбитражным судом республики ингушетияникифоровский областной суд республики карелия,никифоровским областным судом республики карелияас московского округа,ас московского округасу 112 республика коми,су 112 республика комибелокалитвинский межрайонный суд республики тыва,белокалитвинским межрайонным судом республики тывамс липецкой области,мс липецкой областису 205 города севастополя,су 205 города севастополямс республики калмыкия,мс республики калмыкияфедеральный участок кемеровской области,федеральным участком кемеровской областифедеральный суд республики адыгеи,федеральным судом республики адыгеи