lawer,lawer_tpрузский городской суд г омска,рузским городским судом г омскакаширский мый суд г тюмени,каширским мым судом г тюменибологовский кассационный суд рсоалания,бологовским кассационным судом рсоаланиякамышинский межрайонный суд челябинской области,камышинским межрайонным судом челябинской областисудебный участок 213 города сочи,судебным участком 213 города сочизавитинский город суд санктпетербурга,завитинским городским судом санктпетербургабердский мый суд липецкой области,бердским мым судом липецкой областимировой суд респбурятия,мировым судом респбурятиялукояновский кассационный суд г волгоград,лукояновским кассационным судом г волгоградарбитражный суд красноярского края,арбитражным судом красноярского краяселивановский кассационный суд забайкальского края,селивановским кассационным судом забайкальского краямс су 80 г братска,мс су 80 г братскафу г новая ляля,фу г новая лялясу 54 псковской области,су 54 псковской областижелезноводский город суд г анапа,железноводским городским судом г анапападунский межрайонный суд города сочи краснодарского края,падунским межрайонным судом города сочи краснодарского краяпушкиногорский военный суд карачаевочеркесской республики,пушкиногорским военным судом карачаевочеркесской республикиарбитражный суд г каменскуральского,арбитражным судом г каменскуральскогоашинский районный суд ярославской области,ашинским районным судом ярославской областибейский кассационный суд амурской области,бейским кассационным судом амурской областису 177 г кемерово,су 177 г кемеровофу забайкальского края,фу забайкальского краяас г благовещенск,ас г благовещенскгунибский кассационный суд брянской области,гунибским кассационным судом брянской областибаргузинский город суд белгородской обл,баргузинским городским судом белгородской облмссу 111 г владикавказа,мссу 111 г владикавказафу г благовещенск,фу г благовещенсксу 279 г орска,су 279 г орскасу 284 алтайского края,су 284 алтайского краяколышлейский областной суд астраханской области,колышлейским областным судом астраханской областитайшетский мый суд г новороссийска,тайшетским мым судом г новороссийскаприкубанский кассационный суд города тольятти самарской области,прикубанским кассационным судом города тольятти самарской областиазнакаевский межрайонный суд амурской области,азнакаевским межрайонным судом амурской областиливенский город суд г магнитогорска,ливенским городским судом г магнитогорскатабасаранский кассационный суд воронежской обл,табасаранским кассационным судом воронежской облаяномайский кассационный суд города тольятти самарской обл,аяномайским кассационным судом города тольятти самарской облзамоскворецкий город суд г ярославля,замоскворецким городским судом г ярославляарбитражный суд смоленской области,арбитражным судом смоленской областифедеральный суд владимирской области,федеральным судом владимирской областисудебный участок 173 томской области,судебным участком 173 томской областисудебный участок 258 г барнаула,судебным участком 258 г барнауласу 219 г волгограда,су 219 г волгоградановооскольский областной суд республики татарстан,новооскольским областным судом республики татарстаничалковский мый суд г лесного,ичалковским мым судом г лесногомс амурской области,мс амурской областивуктыльский областной суд г нижний новгород,вуктыльским областным судом г нижний новгородзападнодвинский районный суд саратовской области,западнодвинским районным судом саратовской областимс су 115 города нновгорода,мс су 115 города нновгородасу 231 г иваново,су 231 г ивановокимовский военный суд общей юрисдикции,кимовским военным судом общей юрисдикцииленинсккузнецкий городской суд г новокузнецка,ленинсккузнецким городским судом г новокузнецкаас г грозного,ас г грозногомссу 105 г орска,мссу 105 г орскафс города сочи,фс города сочиконаковский районный суд еао,конаковским районным судом еаомссу 257 республики татарстан,мссу 257 республики татарстанклинцовский военный суд г красноярска,клинцовским военным судом г красноярскаревдинский город суд города санктпетербург,ревдинским городским судом города санктпетербургленинградский городской суд рб,ленинградским городским судом рбфедеральный суд г сочи,федеральным судом г сочицимлянский областной суд ро,цимлянским областным судом ромировой суд оренбургской области,мировым судом оренбургской областиустьабаканский город суд г севастополя,устьабаканским городским судом г севастополяоктябрьский городской суд г ставрополя,октябрьским городским судом г ставрополязмеиногорский город суд кабардинобалкарской республики,змеиногорским городским судом кабардинобалкарской республикиугловский военный суд кировской области,угловским военным судом кировской областифедеральный участок г рязани,федеральным участком г рязанимс су 188 г казани,мс су 188 г казаничукотский кассационный суд республики коми,чукотским кассационным судом республики комиюрлинский кассационный суд респбашкортостан,юрлинским кассационным судом респбашкортостанюрьевпольский межрайонный суд красноярского края,юрьевымпольским межрайонным судом красноярского краябольшеболдинский кассационный суд г уфы,большеболдинским кассационным судом г уфымссу 268 г красноярска,мссу 268 г красноярскатрусовский мый суд ак,трусовским мым судом акдонецкий мый суд республики татарстан,донецким мым судом республики татарстанординский областной суд чеченской республики,ординским областным судом чеченской республикибеломорский мый суд оренбургской области,беломорским мым судом оренбургской областитопкинский город суд г москвы,топкинским городским судом г москвыкувандыкский мый суд г севастополя,кувандыкским мым судом г севастополяарбитражный суд новгородской области,арбитражным судом новгородской областиас республики башкортостан,ас республики башкортостанарбитражный суд республика коми,арбитражным судом республика комикотельниковский кассационный суд г волгограда,котельниковским кассационным судом г волгоградасюмсинский мый суд хб,сюмсинским мым судом хббольшесолдатский районный суд г воронежа,большесолдатским районным судом г воронежаарбитражный суд г волгограда,арбитражным судом г волгоградасу 124 г чебоксары,су 124 г чебоксарыталовский кассационный суд cаратовской области,таловским кассационным судом cаратовской областимоздокский кассационный суд вологодской области,моздокским кассационным судом вологодской областифс города севастополь,фс города севастопользолотухинский город суд г симферополя,золотухинским городским судом г симферополяпермский областной суд московского округа,пермским областным судом московского округафу г грозного,фу г грозногофедеральный участок иркутской области,федеральным участком иркутской областимс cаратовской области,мс cаратовской областимс поволжского округа,мс поволжского округафс курской области,фс курской областинерюнгринский мый суд республики хакасия,нерюнгринским мым судом республики хакасияпугачевский апелляционный суд г абакан,пугачёвским апелляционным судом г абакансеченовский городской суд республики алтай,сеченовским городским судом республики алтайнефтеюганский кассационный суд города нижний тагил свердловской области,нефтеюганским кассационным судом города нижний тагил свердловской областибардымский военный суд г симферополя,бардымским военным судом г симферополяуйский военный суд республики крым,уйским военным судом республики крыммс города санктпетербурга и ленинградской области,мс города санктпетербурга и ленинградской областикалманский районный суд города санктпетербурга и ленинградской области,калманским районным судом города санктпетербурга и ленинградской областисердобский город суд г владикавказа,сердобским городским судом г владикавказастарожиловский военный суд г нижний новгород,старожиловским военным судом г нижний новгородсудебный участок 60 чукотского автономного округа,судебным участком 60 чукотского автономного округафедеральный участок г костромы,федеральным участком г костромыбелокурихинский город суд республики калмыкия,белокурихинским городским судом республики калмыкияфс камчатского края,фс камчатского краямс ивановской области,мс ивановской областисолецкий военный суд г новая ляля,солецким военным судом г новая лялякрасноуральский кассационный суд кк,красноуральским кассационным судом ккпетроградский районный суд г нижний новгород,петроградским районным судом г нижний новгородкораблинский межрайонный суд респ татарстан,кораблинским межрайонным судом респ татарстанякутский городской суд самарской обл,якутским городским судом самарской облджейрахский кассационный суд ростовской обл,джейрахским кассационным судом ростовской облсудебный участок 137 новосибирской области,судебным участком 137 новосибирской областимогочинский межрайонный суд волгоградской области,могочинским межрайонным судом волгоградской областикурский областной суд респбурятия,курским областным судом респбурятияюжноуральский кассационный суд ак,южноуральским кассационным судом акоренбургский апелляционный суд г иваново,оренбургским апелляционным судом г ивановобутурлинский районный суд города санктпетербург и ленинградской области,бутурлинским районным судом города санктпетербург и ленинградской областидобринский военный суд респмордовия,добринским военным судом респмордовиякнягининский рый суд тульской области,княгининским рым судом тульской областиягоднинский областной суд еврейской автономной области,ягоднинским областным судом еврейской автономной областиомский областной суд города севастополя,омским областным судом города севастополянекоузский апелляционный суд ставропольского края,некоузским апелляционным судом ставропольского краябатайский мый суд г ульяновска,батайским мым судом г ульяновскапартизанский военный суд респбашкортостан,партизанским военным судом респбашкортостанарбитражный суд иркутской обл,арбитражным судом иркутской обллангепасский кассационный суд г магнитогорска,лангепасским кассационным судом г магнитогорскакривошеинский межрайонный суд г санктпетербурга и ло,кривошеинским межрайонным судом г санктпетербурга и ломс республики крым,мс республики крымуренский кассационный суд г казани,уренским кассационным судом г казаниас рт,ас ртниколаевский мый суд ак,николаевским мым судом акарбитражный суд республика калмыкия,арбитражным судом республика калмыкиямссу 255 еао,мссу 255 еаоивнянский апелляционный суд г владимира,ивнянским апелляционным судом г владимирамс г кемерово,мс г кемеровосудебный участок 55 саратовской области,судебным участком 55 саратовской областисаяногорский областной суд калужской области,саяногорским областным судом калужской областичернянский апелляционный суд севастополя,чернянским апелляционным судом севастополямссу 84 свердловской области,мссу 84 свердловской областиас республики алтай,ас республики алтайханкайский городской суд мурманской области,ханкайским городским судом мурманской областимоскаленский город суд нижегородская обл,москаленским городским судом нижегородская облшумихинский город суд республики тыва,шумихинским городским судом республики тывановосибирский рый суд кемеровской области,новосибирским рым судом кемеровской областикаргапольский областной суд калининградской области,каргапольским областным судом калининградской областимс республика коми,мс республика комибалашовский мый суд г мурманска,балашовским мым судом г мурмансканаровчатский апелляционный суд г курска,наровчатским апелляционным судом г курскаас г сочи,ас г сочифс г благовещенск,фс г благовещенскмировой суд города твери тверской области,мировым судом города твери тверской областивелижский рый суд г нижний новгород,велижским рым судом г нижний новгородалагирский областной суд г воронежа,алагирским областным судом г воронежаас города санктпетербург и ленинградской области,ас города санктпетербург и ленинградской областимонгунтайгинский областной суд г саранска,монгунтайгинским областным судом г саранскафедеральный суд города санктпетербурга,федеральным судом города санктпетербургамс г сыктывкара,мс г сыктывкарамеждуреченский кассационный суд тульской области,междуреченским кассационным судом тульской областиблаговещенский межрайонный суд г комсомольсканаамуре,благовещенским межрайонным судом г комсомольсканаамуремс чувашской респ,мс чувашской респфедеральный суд смоленской области,федеральным судом смоленской областимировой суд г астрахани,мировым судом г астраханиас г томска,ас г томскакоркинский мый суд мурманской области,коркинским мым судом мурманской областизаинский рый суд города волгоград,заинским рым судом города волгоградкадуйский кассационный суд республика коми,кадуйским кассационным судом республика комимировой суд ленинградской области,мировым судом ленинградской областисудебный участок 223 г анапа,судебным участком 223 г анапанадтеречный рый суд немецкого национального района,надтеречным рым судом немецкого национального районаурмарский кассационный суд г владикавказа,урмарским кассационным судом г владикавказаколосовский кассационный суд ульяновской области,колосовским кассационным судом ульяновской областисудебный участок 197 г иркутска,судебным участком 197 г иркутскаанадырский рый суд города санктпетербурга и ленинградской области,анадырским рым судом города санктпетербурга и ленинградской областисемилукский город суд г спб,семилукским городским судом г спбфу г орска,фу г орскамссу 245 республики мордовия,мссу 245 республики мордовияприволжский апелляционный суд города казани,приволжским апелляционным судом города казаниправдинский город суд кемеровской области,правдинским городским судом кемеровской областифс г твери,фс г твериарбитражный суд сахалинской области,арбитражным судом сахалинской областифс тамбовской области,фс тамбовской областисудебный участок 156 г архангельска,судебным участком 156 г архангельскамс брянской области,мс брянской областииультинский военный суд города казани,иультинским военным судом города казанимс су 259 г оренбурга,мс су 259 г оренбурга