lawer,lawer_tpКурагинский город суд республики Дагестан,Курагинским городским судом республики ДагестанАсиновский районный суд АК,Асиновским районным судом АКУсть-вымский кассационный суд г. Санкт-петербурга И ЛО,Усть-вымским кассационным судом г. Санкт-петербурга И ЛОКамчатский апелляционный суд г. Комсомольска-на-амуре,Камчатским апелляционным судом г. Комсомольска-на-амуреСосновоборский р-ый суд Волгоградской обл.,Сосновоборским р-ым судом Волгоградской обл.Нововятский апелляционный суд города н.новгород,Нововятским апелляционным судом города н.новгородТабасаранский кассационный суд Воронежской обл.,Табасаранским кассационным судом Воронежской обл.Троицкий р-ый суд Свердловской области,Троицким р-ым судом Свердловской областиИркутский р-ый суд г. Санкт-петербурга,Иркутским р-ым судом г. Санкт-петербургаНефтеюганский кассационный суд города нижний тагил Свердловской области,Нефтеюганским кассационным судом города нижний тагил Свердловской областиСеливановский кассационный суд забайкальского края,Селивановским кассационным судом забайкальского краяБаяндаевский военный суд г. Каменск-уральского,Баяндаевским военным судом г. Каменск-уральскогоКовдорский межрайонный суд г. Сыктывкара,Ковдорским межрайонным судом г. СыктывкараГеоргиевский областной суд республики Крым,Георгиевским областным судом республики КрымПриаргунский военный суд г. Орла,Приаргунским военным судом г. ОрлаРебрихинский город. суд Тамбовской области,Ребрихинским городским судом Тамбовской областиНаро-фоминский районный суд Нижегородской области,Наро-фоминским районным судом Нижегородской областиКольчугинский апелляционный суд рсо-алания,Кольчугинским апелляционным судом рсо-аланияИлишевский р-ый суд респ.крым,Илишевским р-ым судом респ.крымЧугуевский районный суд города н.новгород,Чугуевским районным судом города н.новгородБольшемуртинский межрайонный суд г. Новокузнецка,Большемуртинским межрайонным судом г. НовокузнецкаМаксатихинский военный суд г. Орска,Максатихинским военным судом г. ОрскаМенделеевский город суд города Волгоград,Менделеевским городским судом города ВолгоградСеверо-курильский апелляционный суд Магаданской области,Северо-курильским апелляционным судом Магаданской областиЭлектростальский военный суд города Сочи,Электростальским военным судом города СочиБердский м-ый суд Липецкой области,Бердским м-ым судом Липецкой областиПоспелихинский областной суд г. Ставрополя,Поспелихинским областным судом г. СтаврополяКрасноглинский город суд чувашской республики - чувашии,Красноглинским городским судом чувашской республики - чувашииКумертауский межрайонный суд г. Махачкалы,Кумертауским межрайонным судом г. МахачкалыВолчихинский город. суд г. Новокузнецка,Волчихинским городским судом г. НовокузнецкаСегежский город суд г. Ульяновска,Сегежским городским судом г. УльяновскаВоронежский город суд г. Читы,Воронежским городским судом г. ЧитыСергокалинский межрайонный суд города Казани,Сергокалинским межрайонным судом города КазаниПриокский апелляционный суд г. нижний тагил,Приокским апелляционным судом г. нижний тагилБуденновский кассационный суд г. Мурманска,Будённовским кассационным судом г. МурманскаСемикаракорский районный суд г. Волгоград,Семикаракорским районным судом г. ВолгоградБарышский р-ый суд Смоленской области,Барышским р-ым судом Смоленской областиПетуховский кассационный суд респ.хакасия,Петуховским кассационным судом респ.хакасияПриволжский апелляционный суд города Казани,Приволжским апелляционным судом города КазаниТроицко-печорский р-ый суд Воронежской области,Троицко-печорским р-ым судом Воронежской областиЮтазинский военный суд приморского края,Ютазинским военным судом приморского краяПетропавловский кассационный суд города Саратова,Петропавловским кассационным судом города СаратоваЛовозерский военный суд Кабардино-балкарской республики,Ловозерским военным судом Кабардино-балкарской республикиЛихославльский городской суд города нижний тагил Свердловской области,Лихославльским городским судом города нижний тагил Свердловской областиУльчский город. суд г. Владимира,Ульчским городским судом г. ВладимираДорогобужский город суд г. Новороссийска,Дорогобужским городским судом г. НовороссийскаМалосердобинский межрайонный суд РМЭ,Малосердобинским межрайонным судом РМЭВидновский областной суд города Тольятти Самарской области,Видновским областным судом города Тольятти Самарской областиРайчихинский городской суд республика Калмыкия,Райчихинским городским судом республика КалмыкияЛевобережный районный суд Новгородской области,Левобережным районным судом Новгородской областиПоныровский районный суд Нижегородской области,Поныровским районным судом Нижегородской областиСветловский военный суд г. Красноярска,Светловским военным судом г. КрасноярскаТаловский кассационный суд cаратовской области,Таловским кассационным судом cаратовской областиБогородицкий город суд Ростовской области,Богородицким городским судом Ростовской областиНовомосковский военный суд республики Ингушетия,Новомосковским военным судом республики ИнгушетияТопкинский город. суд г. Москвы,Топкинским городским судом г. МосквыКурганинский районный суд г. Екатеринбурга,Курганинским районным судом г. ЕкатеринбургаМясниковский межрайонный суд г. Липецка,Мясниковским межрайонным судом г. ЛипецкаУсть-илимский городской суд г. Волгограда,Усть-илимским городским судом г. ВолгоградаВейделевский областной суд РТ,Вейделевским областным судом РТПравдинский город суд Кемеровской области,Правдинским городским судом Кемеровской областиМосковский городской суд республики Крым,Московским городским судом республики КрымЧаинский военный суд Воронежской обл.,Чаинским военным судом Воронежской обл.Пущинский областной суд Ивановской области,Пущинским областным судом Ивановской областиФурмановский районный суд г. Кирова,Фурмановским районным судом г. КироваГайнский р-ый суд г. Красноярска,Гайнским р-ым судом г. КрасноярскаКоченевский городской суд г. Благовещенск,Коченевским городским судом г. БлаговещенскВолосовский апелляционный суд г. Ульяновска,Волосовским апелляционным судом г. УльяновскаСинарский город. суд г. Волгограда,Синарским городским судом г. ВолгоградаКрасноармейский военный суд города Комсомольска-на-амуре хабаровского края,Красноармейским военным судом города Комсомольска-на-амуре хабаровского краяКняжпогостский районный суд ханты-мансийского автономного округа - югры,Княжпогостским районным судом ханты-мансийского автономного округа - югрыЭнгельсский военный суд красноярского КР.,Энгельсским военным судом красноярского КР.Лабытнангский военный суд Владимирской области,Лабытнангским военным судом Владимирской областиМазановский город. суд города Тольятти,Мазановским городским судом города ТольяттиЧернянский апелляционный суд Севастополя,Чернянским апелляционным судом СевастополяКалачеевский апелляционный суд г. Мурманска,Калачеевским апелляционным судом г. МурманскаКаслинский военный суд республики Марий ЭЛ,Каслинским военным судом республики Марий ЭЛСерафимовичский межрайонный суд чукотского автономного округа,Серафимовичским межрайонным судом чукотского автономного округаКумторкалинский м-ый суд г. Саратова,Кумторкалинским м-ым судом г. СаратоваМалоархангельский р-ый суд города Тольятти,Малоархангельским р-ым судом города ТольяттиУзловский р-ый суд г. Смоленска,Узловским р-ым судом г. СмоленскаВерхнеуслонский военный суд г. Грозного,Верхнеуслонским военным судом г. ГрозногоУсть-камчатский военный суд г. Симферополя,Усть-камчатским военным судом г. СимферополяВладимирский межрайонный суд республики Ингушетия,Владимирским межрайонным судом республики ИнгушетияЕткульский р-ый суд города Твери Тверской области,Еткульским р-ым судом города Твери Тверской областиСоломбальский межрайонный суд г. Чебоксары,Соломбальским межрайонным судом г. ЧебоксарыМирнинский апелляционный суд Самарской обл.,Мирнинским апелляционным судом Самарской обл.Кореновский город. суд респ.хакасия,Кореновским городским судом респ.хакасияЗолотухинский город. суд г. Симферополя,Золотухинским городским судом г. СимферополяКедровский город. суд города Каменск-уральского Свердловской области,Кедровским городским судом города Каменск-уральского Свердловской областиМантуровский апелляционный суд города Комсомольска-на-амуре хабаровского края,Мантуровским апелляционным судом города Комсомольска-на-амуре хабаровского краяЛысьвенский районный суд Орловской области,Лысьвенским районным судом Орловской областиМещанский военный суд Тверской области,Мещанским военным судом Тверской областиТерский кассационный суд Амурской области,Терским кассационным судом Амурской областиЧеремшанский кассационный суд cаратовской области,Черемшанским кассационным судом cаратовской областиРостовский городской суд cаратовской области,Ростовским городским судом cаратовской областиВятскополянский город суд города Комсомольска-на-амуре хабаровского края,Вятскополянским городским судом города Комсомольска-на-амуре хабаровского краяЛешуконский городской суд г. Комсомольска-на-амуре,Лешуконским городским судом г. Комсомольска-на-амуреЗюзинский районный суд РО,Зюзинским районным судом РОВыборгский город суд Иркутской области,Выборгским городским судом Иркутской областиУсть-ишимский межрайонный суд Белгородской области,Усть-ишимским межрайонным судом Белгородской областиУсть-джегутинский межрайонный суд республики Адыгея,Усть-джегутинским межрайонным судом республики АдыгеяЧудовский межрайонный суд Вологодской области,Чудовским межрайонным судом Вологодской областиЧамзинский р-ый суд г. Липецка,Чамзинским р-ым судом г. ЛипецкаКавказский город. суд города Екатеринбурга Свердловской области,Кавказским городским судом города Екатеринбурга Свердловской областиБольшереченский р-ый суд республики Бурятия,Большереченским р-ым судом республики БурятияЧемальский военный суд Самарской области,Чемальским военным судом Самарской областиКалтанский военный суд республики Саха (якутия),Калтанским военным судом республики Саха (якутия)Устьянский межрайонный суд Нижегородской обл.,Устьянским межрайонным судом Нижегородской обл.Нехаевский город. суд города Санкт-петербурга И Ленинградской области,Нехаевским городским судом города Санкт-петербурга И Ленинградской областиКунцевский город суд Пензенская обл.,Кунцевским городским судом Пензенская обл.Ноябрьский районный суд Псковской области,Ноябрьским районным судом Псковской областиЧеремисиновский город. суд города Санкт-петербурга И ЛО,Черемисиновским городским судом города Санкт-петербурга И ЛОНерчинский городской суд г. Смоленска,Нерчинским городским судом г. СмоленскаЕгорьевский кассационный суд Волгоградской обл.,Егорьевским кассационным судом Волгоградской обл.Газимуро-заводский апелляционный суд Свердловской области,Газимуро-заводским апелляционным судом Свердловской областиИпатовский областной суд Брянской области,Ипатовским областным судом Брянской областиЛевашинский город суд АК,Левашинским городским судом АККрасногвардейский межрайонный суд КК,Красногвардейским межрайонным судом ККСямженский городской суд г. СПБ И ЛО,Сямженским городским судом г. СПБ И ЛООльский городской суд г. Улан-удэ,Ольским городским судом г. Улан-удэНамский межрайонный суд чукотского автономного округа,Намским межрайонным судом чукотского автономного округаСузунский апелляционный суд ХБ,Сузунским апелляционным судом ХБДальнереченский р-ый суд Псковской области,Дальнереченским р-ым судом Псковской областиВилегодский город. суд г. Ростова-на-дону,Вилегодским городским судом г. Ростова-на-донуНиколаевский м-ый суд АК,Николаевским м-ым судом АКЯшалтинский город суд приморского края,Яшалтинским городским судом приморского краяКобяйский м-ый суд Санкт-петербурга,Кобяйским м-ым судом Санкт-петербургаКунгурский м-ый суд города нижний тагил Свердловской области,Кунгурским м-ым судом города нижний тагил Свердловской областиПровиденский областной суд Омской области,Провиденским областным судом Омской областиАнгарский межрайонный суд пермского края,Ангарским межрайонным судом пермского краяМарьяновский м-ый суд Вологодской области,Марьяновским м-ым судом Вологодской областиДоволенский областной суд Калининградской области,Доволенским областным судом Калининградской областиИрбейский р-ый суд города нижний тагил Свердловской области,Ирбейским р-ым судом города нижний тагил Свердловской областиКонстантиновский город суд Иркутской обл.,Константиновским городским судом Иркутской обл.Орловский городской суд республики Тыва,Орловским городским судом республики ТываСаракташский военный суд г. Самары,Саракташским военным судом г. СамарыБасманный городской суд г. Владикавказа,Басманным городским судом г. ВладикавказаСтановлянский м-ый суд Тульской области,Становлянским м-ым судом Тульской областиУсть-донецкий городской суд г. Волгоград,Усть-донецким городским судом г. ВолгоградТамалинский военный суд Оренбургской области,Тамалинским военным судом Оренбургской областиКытмановский м-ый суд г. Самары,Кытмановским м-ым судом г. СамарыЗеленоградский м-ый суд АК,Зеленоградским м-ым судом АККраснознаменский областной суд Новосибирской области,Краснознаменским областным судом Новосибирской областиКандалакшский военный суд г. Казани,Кандалакшским военным судом г. КазаниБорзинский областной суд республики Тыва,Борзинским областным судом республики ТываЯйский военный суд города Азов,Яйским военным судом города АзовАрдатовский кассационный суд Самарской обл.,Ардатовским кассационным судом Самарской обл.Шатковский военный суд Иркутской обл.,Шатковским военным судом Иркутской обл.Яшкульский р-ый суд Мурманской области,Яшкульским р-ым судом Мурманской областиБелинский город. суд г. Челябинска,Белинским городским судом г. ЧелябинскаБатыревский межрайонный суд Ростовской области,Батыревским межрайонным судом Ростовской областиОконешниковский апелляционный суд г. Ижевска,Оконешниковским апелляционным судом г. Ижевска