lawer,lawer_tpМурашинский город. суд республики Алтай,Мурашинским городским судом республики АлтайПировский городской суд республики Башкортостан,Пировским городским судом республики БашкортостанТретьяковский кассационный суд Ростовской области,Третьяковским кассационным судом Ростовской областиКиреевский военный суд Тульской области,Киреевским военным судом Тульской областиКиржачский р-ый суд Псковской области,Киржачским р-ым судом Псковской областиДмитровский межрайонный суд г. Новосибирска,Дмитровским межрайонным судом г. НовосибирскаНовошахтинский город. суд города Санкт-петербурга И Ленинградской области,Новошахтинским городским судом города Санкт-петербурга И Ленинградской областиУдорский город. суд КК,Удорским городским судом КККарачаевский областной суд чувашской республики - чувашии,Карачаевским областным судом чувашской республики - чувашииУсть-кутский город суд г. Красноярска,Устью-кутскиём городским судом г. КрасноярскаГородищенский р-ый суд нижегородский обл.,Городищенским р-ым судом нижегородский обл.Новодвинский городской суд г. Балахна,Новодвинским городским судом г. БалахнаСреднеканский р-ый суд г. Белгорода,Среднеканским р-ым судом г. БелгородаВуктыльский областной суд г. нижний новгород,Вуктыльским областным судом г. нижний новгородВоскресенский город. суд Курской области,Воскресенским городским судом Курской областиСебежский районный суд Нижегородской обл.,Себежским районным судом Нижегородской обл.Советский кассационный суд Новосибирской области,Советским кассационным судом Новосибирской областиСальский военный суд респ.мордовия,Сальским военным судом респ.мордовияКозловский кассационный суд Удмуртской республики,Козловским кассационным судом Удмуртской республикиСерышевский город. суд забайкальского края,Серышевским городским судом забайкальского краяВенгеровский областной суд cаратовской области,Венгеровским областным судом cаратовской областиСуворовский военный суд нижегородский обл.,Суворовским военным судом нижегородский обл.Черногорский апелляционный суд города Волгоград,Черногорским апелляционным судом города ВолгоградЛюдиновский областной суд немецкого национального района,Людиновским областным судом немецкого национального районаЧернушинский межрайонный суд чукотского автономного округа,Чернушинским межрайонным судом чукотского автономного округаДолгопрудненский межрайонный суд г. Самары,Долгопрудненским межрайонным судом г. СамарыОстанкинский город суд Кировской области,Останкинским городским судом Кировской областиШахунский областной суд г. Пензы,Шахунским областным судом г. ПензыЗаокский кассационный суд города н.новгорода,Заокским кассационным судом города н.новгородаМытищинский городской суд г. Астрахани,Мытищинским городским судом г. АстраханиЛакский межрайонный суд ХБ,Лакским межрайонным судом ХБМамонтовский областной суд Сахалинской области,Мамонтовским областным судом Сахалинской областиЯмальский р-ый суд г. Новокузнецка,Ямальским р-ым судом г. НовокузнецкаТукаевский межрайонный суд г. Братска,Тукаевским межрайонным судом г. БратскаСветлогорский город. суд Вологодской области,Светлогорским городским судом Вологодской областиРамонский городской суд Курской области,Рамонским городским судом Курской областиТатарский районный суд ямало-ненецкого автономного округа,Татарским районным судом ямало-ненецкого автономного округаКарагайский районный суд Калининградской области,Карагайским районным судом Калининградской областиИвановский военный суд г. Саратова,Ивановским военным судом г. СаратоваКарабудахкентский военный суд Тульской области,Карабудахкентским военным судом Тульской областиБалахтинский межрайонный суд г. Омска,Балахтинским межрайонным судом г. ОмскаЕланский районный суд г. Мурманска,Еланским районным судом г. МурманскаОбливский областной суд Оренбургской области,Обливским областным судом Оренбургской областиЕманжелинский областной суд Тверской области,Еманжелинским областным судом Тверской областиАндроповский областной суд забайкальского края,Андроповским областным судом забайкальского краяНижегородский апелляционный суд Псковской области,Нижегородским апелляционным судом Псковской областиКрасночикойский городской суд Рязанской области,Красночикойским городским судом Рязанской областиТавдинский районный суд Волгоградской обл.,Тавдинским районным судом Волгоградской обл.Сокольский город суд г. Ставрополя,Сокольским городским судом г. СтаврополяПристенский областной суд г. Орла,Пристенским областным судом г. ОрлаКраснокутский межрайонный суд г. Москвы,Краснокутским межрайонным судом г. МосквыУнинский кассационный суд приморского края,Унинским кассационным судом приморского краяБратский кассационный суд города Санкт-петербурга,Братским кассационным судом города Санкт-петербургаОкуловский город суд ставропольский край,Окуловским городским судом ставропольский крайАдамовский город суд республики Мордовия,Адамовским городским судом республики МордовияПыталовский военный суд города Абакан,Пыталовским военным судом города АбаканПорховский р-ый суд Рязанской области,Порховским р-ым судом Рязанской областиНижнеломовский апелляционный суд города н.новгород,Нижнеломовским апелляционным судом города н.новгородГородовиковский м-ый суд республики Хакасия,Городовиковским м-ым судом республики ХакасияАбанский межрайонный суд УР,Абанским межрайонным судом УРОдинцовский военный суд г. Прокопьевска,Одинцовским военным судом г. ПрокопьевскаБалтасинский районный суд города н.новгорода,Балтасинским районным судом города н.новгородаГаличский областной суд города Санкт-петербург И Ленинградской области,Галичским областным судом города Санкт-петербург И Ленинградской областиАнивский город суд г. Орла,Анивским городским судом г. ОрлаКатав-ивановский районный суд города Каменск-уральского Свердловской области,Катав-ивановским районным судом города Каменск-уральского Свердловской областиСпасский городской суд г. Москвы,Спасским городским судом г. МосквыНовотроицкий городской суд города н.новгорода,Новотроицким городским судом города н.новгородаМишкинский межрайонный суд Липецкой области,Мишкинским межрайонным судом Липецкой областиУстюженский город. суд г. Читы,Устюженским городским судом г. ЧитыВилючинский районный суд ЕАО,Вилючинским районным судом ЕАОБабушкинский город. суд города Сочи краснодарского края,Бабушкинским городским судом города Сочи краснодарского краяЗареченский районный суд г. Екатеринбурга Свердловской области,Зареченским районным судом г. Екатеринбурга Свердловской областиШипуновский кассационный суд приморского края,Шипуновским кассационным судом приморского краяКемеровский районный суд Ульяновской области,Кемеровским районным судом Ульяновской областиШемышейский военный суд Свердловская область,Шемышейским военным судом Свердловская областьЛиманский кассационный суд Тверской области,Лиманским кассационным судом Тверской областиАлександровский городской суд Сахалинской области,Александровским городским судом Сахалинской областиБалаганский кассационный суд Ростовской области,Балаганским кассационным судом Ростовской областиИсилькульский военный суд г. Владимира,Исилькульским военным судом г. ВладимираСолнечный межрайонный суд г. Санкт-петербурга,Солнечным межрайонным судом г. Санкт-петербургаВожегодский м-ый суд г. Тюмени,Вожегодским м-ым судом г. ТюмениСухиничский городской суд пермского края,Сухиничским городским судом пермского краяЖердевский военный суд г. Орска,Жердевским военным судом г. ОрскаЯгоднинский областной суд Еврейской автономной области,Ягоднинским областным судом Еврейской автономной областиХивский город суд республики Алтай,Хивским городским судом республики АлтайЧишминский город. суд г. Новороссийска,Чишминским городским судом г. НовороссийскаТернейский областной суд Санкт-петербурга,Тернейским областным судом Санкт-петербургаЖелезногорский м-ый суд г. Липецка,Железногорским м-ым судом г. ЛипецкаКетовский город. суд города Санкт-петербурга И ЛО,Кетовским городским судом города Санкт-петербурга И ЛОУвинский районный суд московского округа,Увинским районным судом московского округаТорбеевский кассационный суд города Азов,Торбеевским кассационным судом города АзовАртемовский м-ый суд пермского края,Артемовским м-ым судом пермского краяКош-агачский апелляционный суд г. Улан-удэ,Кош-агачским апелляционным судом г. Улан-удэПролетарский город. суд РБ,Пролетарским городским судом РББрасовский межрайонный суд Кабардино-балкарской республики,Брасовским межрайонным судом Кабардино-балкарской республикиГлушковский город суд чукотского автономного округа,Глушковским городским судом чукотского автономного округаЧаа-хольский городской суд г. Ижевска,Чаа-хольским городским судом г. ИжевскаБижбулякский р-ый суд г. нижний тагил,Бижбулякским р-ым судом г. нижний тагилНижнеудинский городской суд ХБ,Нижнеудинским городским судом ХБМысковский военный суд республики Тыва,Мысковским военным судом республики ТываТяжинский районный суд Орловской области,Тяжинским районным судом Орловской областиУсть-янский р-ый суд Челябинской области,Усть-янским р-ым судом Челябинской областиЛебяжьевский областной суд Калужской области,Лебяжьевским областным судом Калужской областиХорошевский городской суд камчатского края,Хорошевским городским судом камчатского краяУссурийский межрайонный суд города н.новгород,Уссурийским межрайонным судом города н.новгородКушвинский межрайонный суд г. Пензы,Кушвинским межрайонным судом г. ПензыБелокурихинский город. суд республики Калмыкия,Белокурихинским городским судом республики КалмыкияКрасносулинский районный суд Белгородской обл.,Красносулинским районным судом Белгородской обл.Притобольный апелляционный суд г. Новосибирска,Притобольным апелляционным судом г. НовосибирскаКовровский районный суд города Абакан,Ковровским районным судом города АбаканЮргамышский апелляционный суд г. Брянска,Юргамышским апелляционным судом г. БрянскаСреднеахтубинский город суд республики Татарстан,Среднеахтубинским городским судом республики ТатарстанМичуринский городской суд Ульяновской области,Мичуринским городским судом Ульяновской областиВолжский межрайонный суд г. лесного,Волжским межрайонным судом г. лесногоМордовский военный суд респ. Татарстан,Мордовским военным судом респ. ТатарстанРовеньский городской суд г. Воронежа,Ровеньским городским судом г. ВоронежаЩучанский м-ый суд чувашской респ.,Щучанским м-ым судом чувашской респ.Осташковский апелляционный суд Липецкой области,Осташковским апелляционным судом Липецкой областиВанинский город суд г. Саранска,Ванинским городским судом г. СаранскаВязниковский кассационный суд г. Воронежа,Вязниковским кассационным судом г. ВоронежаСудакский апелляционный суд Новосибирской области,Судакским апелляционным судом Новосибирской областиБакчарский город суд Курганской области,Бакчарским городским судом Курганской областиЖигаловский городской суд Кировской области,Жигаловским городским судом Кировской областиРыльский город суд республики Хакасия,Рыльским городским судом республики ХакасияКущевский кассационный суд Кировской области,Кущёвским кассационным судом Кировской областиАбинский кассационный суд города Санкт-петербурга И Ленинградской области,Абинским кассационным судом города Санкт-петербурга И Ленинградской областиВолховский межрайонный суд г. УФЫ,Волховским межрайонным судом г. УФЫТоншаевский межрайонный суд г. Липецка,Тоншаевским межрайонным судом г. ЛипецкаЧертковский военный суд г. Анапа,Чертковским военным судом г. АнапаУстиновский город суд республики Хакасия,Устиновским городским судом республики ХакасияРжаксинский апелляционный суд г. Абакан,Ржаксинским апелляционным судом г. АбаканНахимовский город суд республики Татарстан,Нахимовским городским судом республики ТатарстанОпочецкий апелляционный суд республики Коми,Опочецким апелляционным судом республики КомиВарненский городской суд города Абакан,Варненским городским судом города АбаканТасеевский р-ый суд общей юрисдикции,Тасеевским р-ым судом общей юрисдикцииШегарский р-ый суд г. Архангельска,Шегарским р-ым судом г. АрхангельскаКачканарский город суд города н.новгорода,Качканарским городским судом города н.новгородаТопчихинский военный суд города Казани,Топчихинским военным судом города КазаниАкеайский межрайонный суд ХБ,Акеайским межрайонным судом ХББалезинский межрайонный суд Санкт-петербурга,Балезинским межрайонным судом Санкт-петербургаГаврилов-ямский город. суд Архангельской области,Гаврилов-ямским городским судом Архангельской областиЧернский город. суд Еврейской автономной области,Чернским городским судом Еврейской автономной областиЯрцевский кассационный суд респ.бурятия,Ярцевским кассационным судом респ.бурятияНазрановский районный суд республики Адыгея,Назрановским районным судом республики АдыгеяДжейрахский кассационный суд Ростовской обл.,Джейрахским кассационным судом Ростовской обл.Шарыповский кассационный суд ханты-мансийского автономного округа - югры,Шарыповским кассационным судом ханты-мансийского автономного округа - югрыАктанышский город суд Удмуртской республики,Актанышским городским судом Удмуртской республикиМелеузовский межрайонный суд Ярославской области,Мелеузовским межрайонным судом Ярославской областиТонкинский городской суд республика Калмыкия,Тонкинским городским судом республика КалмыкияДимитровградский кассационный суд г. Тулы,Димитровградским кассационным судом г. ТулыРоссошанский районный суд Нижегородской области,Россошанским районным судом Нижегородской областиКраснофлотский город суд г. Казани,Краснофлотским городским судом г. КазаниКимрский городской суд г. Ростова-на-дону,Кимирским городским судом г. Ростова-на-донуШумячский военный суд Ростовской обл.,Шумячским военным судом Ростовской обл.Абдулинский апелляционный суд г. Краснодара,Абдулинским апелляционным судом г. КраснодараИвнянский апелляционный суд г. Владимира,Ивнянским апелляционным судом г. Владимира