lawer,lawer_tpЗадонский м-ый суд г. Орска,Задонским м-ым судом г. ОрскаБологовский кассационный суд рсо-алания,Бологовским кассационным судом рсо-аланияСелемджинский р-ый суд г. Оренбурга,Селемджинским р-ым судом г. ОренбургаАхтубинский город. суд рсо-алания,Ахтубинским городским судом рсо-аланияКоркинский м-ый суд Мурманской области,Коркинским м-ым судом Мурманской областиАзнакаевский межрайонный суд Амурской области,Азнакаевским межрайонным судом Амурской областиИжемский город. суд города Казань,Ижемским городским судом города КазаньМурманский р-ый суд Севастополя,Мурманским р-ым судом СевастополяПохвистневский апелляционный суд Ростовской области,Похвистневским апелляционным судом Ростовской областиУсть-удинский м-ый суд г Санкт-петербурга,Усть-удинским м-ым судом г Санкт-петербургаСевский районный суд республики Крым,Севским районным судом республики КрымОрджоникидзевский городской суд города нижний тагил Свердловской области,Орджоникидзевским городским судом города нижний тагил Свердловской областиЧеремушкинский город. суд г. Санкт-петербурга,Черёмушкинским городским судом г. Санкт-петербургаБурейский кассационный суд республики Татарстан,Бурейским кассационным судом республики ТатарстанЧановский апелляционный суд г. Магнитогорска,Чановским апелляционным судом г. МагнитогорскаАтяшевский м-ый суд хабаровского края,Атяшевским м-ым судом хабаровского краяСельцовский город. суд ставропольский край,Сельцовским городским судом ставропольский крайГагаринский город. суд ХБ,Гагаринским городским судом ХБКусинский город. суд Новосибирской обл.,Кусинским городским судом Новосибирской обл.Воткинский городской суд г. Владикавказа,Воткинским городским судом г. ВладикавказаСемилукский город суд г. СПБ,Семилукским городским судом г. СПБВыселковский городской суд города Тольятти,Выселковским городским судом города ТольяттиПереславский межрайонный суд республики Алтай,Переславским межрайонным судом республики АлтайПравобережный городской суд Ярославской области,Правобережным городским судом Ярославской областиНадеждинский город. суд г. Тюмени,Надеждинским городским судом г. ТюмениКарагинский м-ый суд г. Санкт-петербурга,Карагинским м-ым судом г. Санкт-петербургаТуапсинский областной суд г. Пензы,Туапсинским областным судом г. ПензыМожгинский областной суд г. Братска,Можгинским областным судом г. БратскаКарабашский город. суд города Комсомольска-на-амуре хабаровского края,Карабашским городским судом города Комсомольска-на-амуре хабаровского краяКозульский военный суд города н.новгорода,Козульским военным судом города н.новгородаСыктывдинский военный суд г. Комсомольска-на-амуре,Сыктывдинским военным судом г. Комсомольска-на-амуреБольшеглушицкий городской суд Московской области,Большеглушицким городским судом Московской областиНогайский апелляционный суд г. Комсомольска-на-амуре,Ногайским апелляционным судом г. Комсомольска-на-амуреГатчинский город суд г. Иваново,Гатчинским городским судом г. ИвановоЛюбинский кассационный суд Псковской области,Любинским кассационным судом Псковской областиРославльский межрайонный суд Пензенская обл.,Рославльским межрайонным судом Пензенская обл.Олёкминский районный суд г. Симферополя,Олёкминским районным судом г. СимферополяИстринский город. суд Новосибирской обл.,Истринским городским судом Новосибирской обл.Артёмовский город суд Карачаево-черкесской республики,Артёмовским городским судом Карачаево-черкесской республикиЮгорский м-ый суд Новосибирской обл.,Югорским м-ым судом Новосибирской обл.Лукояновский кассационный суд г. Волгоград,Лукояновским кассационным судом г. ВолгоградСвердловский городской суд АК,Свердловским городским судом АКЮрлинский кассационный суд респ.башкортостан,Юрлинским кассационным судом респ.башкортостанЧерниговский кассационный суд города Санкт-петербург,Черниговским кассационным судом города Санкт-петербургТомский апелляционный суд Новосибирской области,Томским апелляционным судом Новосибирской областиКочубеевский город. суд ХБ,Кочубеевским городским судом ХБЯкшур-бодьинский р-ый суд г. Санкт-петербурга,Якшур-бодьинским р-ым судом г. Санкт-петербургаТисульский апелляционный суд Брянской области,Тисульским апелляционным судом Брянской областиКазбековский р-ый суд г. Владивостока,Казбековским р-ым судом г. ВладивостокаИзмайловский апелляционный суд города Комсомольска-на-амуре хабаровского края,Измайловским апелляционным судом города Комсомольска-на-амуре хабаровского краяМуравленковский районный суд Архангельской области,Муравленковским районным судом Архангельской областиНорильский межрайонный суд г. Тамбова,Норильским межрайонным судом г. ТамбоваДемский кассационный суд г. Костромы,Демскием кассационным судом г. КостромыДобринский военный суд респ.мордовия,Добринским военным судом респ.мордовияКарпинский военный суд краснодарского края,Карпинским военным судом краснодарского краяКуменский областной суд РБ,Кумёнским областным судом РББалаковский город суд г. Благовещенск,Балаковским городским судом г. БлаговещенскМамадышский р-ый суд г. Сочи,Мамадышским р-ым судом г. СочиНовоспасский районный суд Астраханской области,Новоспасским районным судом Астраханской областиВалуйский р-ый суд г. Махачкалы,Валуйским р-ым судом г. МахачкалыПочепский кассационный суд Карачаево-черкесской республики,Почепским кассационным судом Карачаево-черкесской республикиБирский военный суд Иркутской области,Бирским военным судом Иркутской областиПрикубанский кассационный суд города Тольятти Самарской области,Прикубанским кассационным судом города Тольятти Самарской областиКамышинский межрайонный суд Челябинской области,Камышинским межрайонным судом Челябинской областиПоворинский районный суд ЕАО,Поворинским районным судом ЕАООльгинский город. суд г. Смоленска,Ольгинским городским судом г. СмоленскаКрасновишерский р-ый суд Ивановской области,Красновишерским р-ым судом Ивановской областиКосинский апелляционный суд ставропольский край,Косинским апелляционным судом ставропольский крайКайбицкий областной суд города Санкт-петербурга И ЛО,Кайбицким областным судом города Санкт-петербурга И ЛОКолпинский апелляционный суд ханты-мансийского автономного округа - югры,Колпинским апелляционным судом ханты-мансийского автономного округа - югрыСамарский город. суд г. Воронежа,Самарским городским судом г. ВоронежаКалганский военный суд г. Омска,Калганским военным судом г. ОмскаВысокогорский районный суд г. Новокузнецка,Высокогорским районным судом г. НовокузнецкаБогучарский военный суд РМЭ,Богучарским военным судом РМЭСосновский апелляционный суд г. Екатеринбурга,Сосновским апелляционным судом г. ЕкатеринбургаЗаинский р-ый суд города Волгоград,Заинским р-ым судом города ВолгоградЗимовниковский городской суд города Саратова,Зимовниковским городским судом города СаратоваНиколаевский-на-амуре город. суд камчатского края,Николаевский-на-амуром городским судом камчатского краяАбзелиловский военный суд республика Калмыкия,Абзелиловским военным судом республика КалмыкияКраснотурьинский город суд г. Иркутска,Краснотурьинским городским судом г. ИркутскаДзун-хемчикский м-ый суд Брянской области,Дзун-хемчикским м-ым судом Брянской областиКотовский город суд Санкт-петербурга,Котовским городским судом Санкт-петербургаКромской город. суд республики Адыгеи,Кромским городским судом республики АдыгеиДуховщинский военный суд г. лесного,Духовщинским военным судом г. лесногоТбилисский город суд Тюменской области,Тбилисским городским судом Тюменской областиВерхотурский военный суд Калининградской области,Верхотурским военным судом Калининградской областиИвантеевский апелляционный суд города Москвы,Ивантеевским апелляционным судом города МосквыБорский апелляционный суд г. нижний новгород,Борским апелляционным судом г. нижний новгородЗеленчукский м-ый суд г. Владивостока,Зеленчукским м-ым судом г. ВладивостокаВеневский апелляционный суд респ.бурятия,Веневским апелляционным судом респ.бурятияМегино-кангаласский межрайонный суд Архангельской области,Мегино-кангаласским межрайонным судом Архангельской областиКоряжемский м-ый суд г. Красноярска,Коряжемским м-ым судом г. КрасноярскаУдомельский областной суд г. Кемерово,Удомельским областным судом г. КемеровоМогочинский межрайонный суд Волгоградской области,Могочинским межрайонным судом Волгоградской областиТере-хольский город суд Вологодской области,Тере-хольским городским судом Вологодской областиТомаринский межрайонный суд Томской области,Томаринским межрайонным судом Томской областиКурчатовский городской суд Тверской области,Курчатовским городским судом Тверской областиБобровский м-ый суд г. Ульяновска,Бобровским м-ым судом г. УльяновскаОхотский город. суд Иркутской обл.,Охотским городским судом Иркутской обл.Чердынский м-ый суд г. нижний тагил,Чердынским м-ым судом г. нижний тагилСтарицкий военный суд респ.татарстан,Старицким военным судом респ.татарстанКорсаковский городской суд г. Томска,Корсаковским городским судом г. ТомскаПанинский кассационный суд республики Дагестан,Панинским кассационным судом республики ДагестанСеверский м-ый суд Ивановской области,Северским м-ым судом Ивановской областиНевельский м-ый суд респ.мордовия,Невельским м-ым судом респ.мордовияВадинский военный суд Свердловской области,Вадинским военным судом Свердловской областиМедногорский город. суд г. Самары,Медногорским городским судом г. СамарыВеликолукский апелляционный суд Ульяновской области,Великолукским апелляционным судом Ульяновской областиМагаданский город суд Удмуртской республики,Магаданским городским судом Удмуртской республикиАрзгирский город. суд г. Ульяновска,Арзгирским городским судом г. УльяновскаТракторозаводский апелляционный суд г. дагестанские огни,Тракторозаводским апелляционным судом г. дагестанские огниЛипецкий р-ый суд г. Екатеринбурга,Липецким р-ым судом г. ЕкатеринбургаХарабалинский городской суд г. Волгограда,Харабалинским городским судом г. ВолгоградаМалмыжский военный суд западно-сибирского округа,Малмыжским военным судом западно-сибирского округаКрутихинский межрайонный суд республики Тыва,Крутихинским межрайонным судом республики ТываМедведевский межрайонный суд республики Дагестана,Медведевским межрайонным судом республики ДагестанаОльхонский апелляционный суд Псковской области,Ольхонским апелляционным судом Псковской областиОблученский областной суд г. Абакан,Облученским областным судом г. АбаканКрасноярский межрайонный суд Волгоградской области,Красноярским межрайонным судом Волгоградской областиВалдайский военный суд г. Орска,Валдайским военным судом г. ОрскаБейский кассационный суд Амурской области,Бейским кассационным судом Амурской областиНавлинский кассационный суд Ярославской области,Навлинским кассационным судом Ярославской областиХолмский военный суд республики Карелия,Холмским военным судом республики КарелияПервоуральский военный суд республика Калмыкия,Первоуральским военным судом республика КалмыкияЗавьяловский р-ый суд Нижегородской области,Завьяловским р-ым судом Нижегородской областиЕльнинский апелляционный суд чукотского автономного округа,Ельнинским апелляционным судом чукотского автономного округаДинской город. суд Нижегородская обл.,Динским городским судом Нижегородская обл.Петроградский районный суд г. нижний новгород,Петроградским районным судом г. нижний новгородПушкинский городской суд г. Хабаровска,Пушкинским городским судом г. ХабаровскаКемский городской суд г. Ярославля,Кемским городским судом г. ЯрославляРусско-полянский город суд Еврейской автономной области,Русско-полянским городским судом Еврейской автономной областиБузулукский областной суд респ.бурятия,Бузулукским областным судом респ.бурятияЮрьянский областной суд г. СПБ,Юрьянским областным судом г. СПБАнапский областной суд города Севастополь,Анапским областным судом города СевастопольСолнечногорский м-ый суд г. Кирова,Солнечногорским м-ым судом г. КироваЧеремховский военный суд респ.мордовия,Черемховским военным судом респ.мордовияМоргаушский кассационный суд г. Иркутска,Моргаушским кассационным судом г. ИркутскаМокшанский городской суд г. Владивостока,Мокшанским городским судом г. ВладивостокаДубненский военный суд Брянской области,Дубненским военным судом Брянской областиЛесосибирский р-ый суд республики Северная осетия-алания,Лесосибирским р-ым судом республики Северная осетия-аланияТутаевский военный суд г. Новороссийска,Тутаевским военным судом г. НовороссийскаЧитинский апелляционный суд г. Комсомольска-на-амуре,Читинским апелляционным судом г. Комсомольска-на-амуреСтепновский город суд г. Санкт-петербурга И ЛО,Степновским городским судом г. Санкт-петербурга И ЛОБрюховецкий военный суд Ульяновской области,Брюховецким военным судом Ульяновской областиСеменовский апелляционный суд г. Кирова,Семёновским апелляционным судом г. КироваЕнотаевский областной суд республики Адыгеи,Енотаевским областным судом республики АдыгеиБелебеевский межрайонный суд алтайского края,Белебеевским межрайонным судом алтайского краяБуденновский город суд Новосибирской обл.,Буденновским городским судом Новосибирской обл.Уфимский городской суд ханты-мансийского автономного округа - югры,Уфимским городским судом ханты-мансийского автономного округа - югрыПриморско-ахтарский м-ый суд Калужской области,Приморско-ахтарским м-ым судом Калужской областиЧукотский кассационный суд республики Коми,Чукотским кассационным судом республики КомиНелидовский апелляционный суд г. Перми,Нелидовским апелляционным судом г. ПермиУрванский м-ый суд г. Рязани,Урванским м-ым судом г. РязаниОвюрский м-ый суд г. Ульяновска,Овюрским м-ым судом г. УльяновскаСеверный кассационный суд Ленинградской области,Северным кассационным судом Ленинградской областиХатангский военный суд нижегородский обл.,Хатангским военным судом нижегородский обл.Санкт-петербургский р-ый суд республики Саха (якутия),Санкт-петербургским р-ым судом республики Саха (якутия)Володарский городской суд республики Калмыкия,Володарским городским судом республики Калмыкия