lawer,lawer_tpЗвениговский м-ый суд г. СПБ И ЛО,Звениговским м-ым судом г. СПБ И ЛОКараидельский город. суд Кемеровской области,Караидельским городским судом Кемеровской областиИшимский кассационный суд города н.новгорода,Ишимским кассационным судом города н.новгородаМалопургинский город суд г. Кирова,Малопургинским городским судом г. КироваВерхнеуфалейский военный суд г. Владивостока,Верхнеуфалейским военным судом г. ВладивостокаСосногорский областной суд Вологодской области,Сосногорским областным судом Вологодской областиУлаганский р-ый суд респ.крым,Улаганским р-ым судом респ.крымСарпинский кассационный суд респ.татарстан,Сарпинским кассационным судом респ.татарстанНово-савиновский областной суд города Екатеринбурга Свердловской области,Ново-савиновским областным судом города Екатеринбурга Свердловской областиАскизский межрайонный суд Калужской области,Аскизским межрайонным судом Калужской областиОловяннинский город суд Удмуртской республики,Оловяннинским городским судом Удмуртской республикиТайшетский м-ый суд г. Новороссийска,Тайшетским м-ым судом г. НовороссийскаПрохоровский межрайонный суд г. УФЫ,Прохоровским межрайонным судом г. УФЫХолмогорский р-ый суд Кабардино-балкарской республики,Холмогорским р-ым судом Кабардино-балкарской республикиСут-хольский военный суд чукотского автономного округа,Сут-хольским военным судом чукотского автономного округаНижнетавдинский м-ый суд г. Рязани,Нижнетавдинским м-ым судом г. РязаниГавриловский р-ый суд Псковской области,Гавриловским р-ым судом Псковской областиОлонецкий военный суд Свердловской области,Олонецким военным судом Свердловской областиАкшинский город. суд республики Ингушетия,Акшинским городским судом республики ИнгушетияАльменевский кассационный суд города нижний тагил Свердловской области,Альменевским кассационным судом города нижний тагил Свердловской областиТайгинский м-ый суд г. нижний тагил,Тайгинским м-ым судом г. нижний тагилБольшеболдинский кассационный суд г. УФЫ,Большеболдинским кассационным судом г. УФЫГусевский м-ый суд Еврейской автономной области,Гусевским м-ым судом Еврейской автономной областиЗеметчинский кассационный суд Ростовской области,Земетчинским кассационным судом Ростовской областиБоготольский город. суд города Санкт-петербурга И Ленинградской области,Боготольским городским судом города Санкт-петербурга И Ленинградской областиОмутнинский городской суд республики Калмыкия,Омутнинским городским судом республики КалмыкияШелаболихинский кассационный суд алтайского края,Шелаболихинским кассационным судом алтайского краяИланский м-ый суд респ.башкортостан,Иланским м-ым судом респ.башкортостанПриозерский военный суд города Казань,Приозерским военным судом города КазаньГорномарийский р-ый суд г. Санкт-петербурга,Горномарийским р-ым судом г. Санкт-петербургаМоздокский кассационный суд Вологодской области,Моздокским кассационным судом Вологодской областиПеревозский межрайонный суд Самарской обл.,Перевозским межрайонным судом Самарской обл.Добрянский межрайонный суд г. Тамбова,Добрянским межрайонным судом г. ТамбоваПестовский городской суд г. нижний новгород,Пестовским городским судом г. нижний новгородТретий город. суд г. Саранска,Третьим городским судом г. СаранскаПачелмский районный суд Воронежской обл.,Пачелмским районным судом Воронежской обл.Губахинский м-ый суд г. Благовещенск,Губахинским м-ым судом г. БлаговещенскЛефортовский межрайонный суд города Абакан,Лефортовским межрайонным судом города АбаканБежицкий р-ый суд г. УФЫ,Бежицким р-ым судом г. УФЫЗаднепровский межрайонный суд г. Каменск-уральского,Заднепровским межрайонным судом г. Каменск-уральскогоДербентский районный суд Тульской области,Дербентским районным судом Тульской областиСердобский город суд г. Владикавказа,Сердобским городским судом г. ВладикавказаУсть-большерецкий кассационный суд республики Башкортостан,Усть-большерецким кассационным судом республики БашкортостанНанайский город суд республики Алтай,Нанайским городским судом республики АлтайАлуштинский кассационный суд г. дагестанские огни,Алуштинским кассационным судом г. дагестанские огниБутырский межрайонный суд г. СПБ И ЛО,Бутырским межрайонным судом г. СПБ И ЛОНовоильинский апелляционный суд г. СПБ,Новоильинским апелляционным судом г. СПБНижнедевицкий военный суд республики Дагестана,Нижнедевицким военным судом республики ДагестанаУсть-абаканский город суд г. Севастополя,Усть-абаканским городским судом г. СевастополяТюльганский апелляционный суд г. Калининграда,Тюльганским апелляционным судом г. КалининградаТляратинский город суд Кировской области,Тляратинским городским судом Кировской областиЧердаклинский военный суд Пензенская обл.,Чердаклинским военным судом Пензенская обл.Тимирязевский город. суд республики Дагестана,Тимирязевским городским судом республики ДагестанаЗаводоуковский районный суд г. Костромы,Заводоуковским районным судом г. КостромыЗавитинский город. суд Санкт-петербурга,Завитинским городским судом Санкт-петербургаНовозыбковский м-ый суд западно-сибирского округа,Новозыбковским м-ым судом западно-сибирского округаОчерский межрайонный суд г. Ставрополя,Очёрским межрайонным судом г. СтаврополяЯранский городской суд г. Екатеринбурга,Яранским городским судом г. ЕкатеринбургаИглинский апелляционный суд республики Саха (якутия),Иглинским апелляционным судом республики Саха (якутия)Усольский р-ый суд красноярского края,Усольским р-ым судом красноярского краяКольский р-ый суд пермского края,Кольским р-ым судом пермского краяПетровский апелляционный суд г. Брянска,Петровским апелляционным судом г. БрянскаПреображенский м-ый суд г. лесного,Преображенским м-ым судом г. лесногоМинусинский межрайонный суд г. Костромы,Минусинским межрайонным судом г. КостромыУсть-коксинский город. суд Ульяновской области,Усть-коксинским городским судом Ульяновской областиАннинский р-ый суд г. Улан-удэ,Аннинским р-ым судом г. Улан-удэРомненский военный суд УР,Ромненским военным судом УРМатвеево-курганский городской суд Севастополя,Матвеево-курганским городским судом СевастополяДесногорский районный суд города нижний тагил Свердловской области,Десногорским районным судом города нижний тагил Свердловской областиКиквидзенский город. суд РБ,Киквидзенским городским судом РБЛениногорский городской суд пермского края,Лениногорским городским судом пермского краяНовичихинский р-ый суд г. Челябинска,Новичихинским р-ым судом г. ЧелябинскаСуражский районный суд РБ,Суражским районным судом РБНовоуренгойский городской суд Брянской области,Новоуренгойским городским судом Брянской областиБелозерский военный суд РМЭ,Белозерским военным судом РМЭСоликамский районный суд г. Твери,Соликамским районным судом г. ТвериИгарский кассационный суд республики Татарстан,Игарским кассационным судом республики ТатарстанТюхтетский м-ый суд поволжского округа,Тюхтетским м-ым судом поволжского округаРемонтненский областной суд Курганской области,Ремонтненским областным судом Курганской областиТюкалинский районный суд г. Кемерово,Тюкалинским районным судом г. КемеровоИлекский город суд г. дагестанские огни,Илекским городским судом г. дагестанские огниХохольский м-ый суд г. Самары,Хохольским м-ым судом г. СамарыПодпорожский м-ый суд города Тольятти Самарской обл.,Подпорожским м-ым судом города Тольятти Самарской обл.Фокинский кассационный суд западно-сибирского округа,Фокинским кассационным судом западно-сибирского округаВикуловский город суд города н.новгород,Викуловским городским судом города н.новгородТаганрогский кассационный суд г. Воронежа,Таганрогским кассационным судом г. ВоронежаИсаклинский город. суд г. Барнаула,Исаклинским городским судом г. БарнаулаСтаропромысловский областной суд Сахалинской области,Старопромысловским областным судом Сахалинской областиБеломорский м-ый суд Оренбургской области,Беломорским м-ым судом Оренбургской областиУгловский военный суд Кировской области,Угловским военным судом Кировской областиВоркутинский межрайонный суд г. Москвы,Воркутинским межрайонным судом г. МосквыХанты-мансийский р-ый суд Владимирской области,Ханты-мансийским р-ым судом Владимирской областиХасынский город. суд г. Санкт-петербурга,Хасынским городским судом г. Санкт-петербургаУрицкий межрайонный суд МО,Урицким межрайонным судом МОСлавский апелляционный суд г. СПБ,Славским апелляционным судом г. СПББольшесосновский военный суд респ.татарстан,Большесосновским военным судом респ.татарстанЕлабужский город суд города Екатеринбурга Свердловской области,Елабужским городским судом города Екатеринбурга Свердловской областиРевдинский город. суд города Санкт-петербург,Ревдинским городским судом города Санкт-петербургМуйский город суд города Санкт-петербург,Муйским городским судом города Санкт-петербургЧерекский апелляционный суд ханты-мансийского автономного округа - югры,Черекским апелляционным судом ханты-мансийского автономного округа - югрыУнечский военный суд г. Ижевска,Унечским военным судом г. ИжевскаТашлинский р-ый суд г. Белгорода,Ташлинским р-ым судом г. БелгородаШебекинский город. суд ставропольского края,Шебекинским городским судом ставропольского краяИльинский апелляционный суд г. Грозного,Ильинским апелляционным судом г. ГрозногоРубцовский кассационный суд Кемеровской области,Рубцовским кассационным судом Кемеровской областиСевастопольский город суд забайкальского края,Севастопольским городским судом забайкальского краяКраснощековский город суд г. Екатеринбурга,Краснощёковским городским судом г. ЕкатеринбургаТосненский военный суд г. Сыктывкара,Тосненским военным судом г. СыктывкараШарлыкский областной суд города Каменск-уральского Свердловской области,Шарлыкским областным судом города Каменск-уральского Свердловской областиТихорецкий военный суд города Саратова,Тихорецким военным судом города СаратоваМелекесский районный суд респ.татарстан,Мелекесским районным судом респ.татарстанНерчинско-заводский м-ый суд республики Тыва,Нерчинско-заводским м-ым судом республики ТываНерюнгринский м-ый суд республики Хакасия,Нерюнгринским м-ым судом республики ХакасияАлапаевский военный суд АК,Алапаевским военным судом АКЗольский районный суд города Казани,Зольским районным судом города КазаниГубкинский межрайонный суд города Абакан,Губкинским межрайонным судом города АбаканКочевский областной суд г. нижний новгород,Кочевским областным судом г. нижний новгородЗападнодвинский районный суд Саратовской области,Западнодвинским районным судом Саратовской областиНогликский город суд Мурманской области,Ногликским городским судом Мурманской областиКиевский военный суд краснодарского края,Киевским военным судом краснодарского краяДорогомиловский р-ый суд г. Екатеринбурга Свердловской области,Дорогомиловским р-ым судом г. Екатеринбурга Свердловской областиБавлинский город. суд г. Анапа,Бавлинским городским судом г. АнапаТарногский город суд г. Ростова-на-дону,Тарногским городским судом г. Ростова-на-донуШолоховский город суд города Москвы,Шолоховским городским судом города МосквыСергиево-посадский областной суд республики Мордовия,Сергиево-посадским областным судом республики МордовияДолинский город суд российской федерации,Долинским городским судом российской федерацииКанский военный суд республики Татарстан,Канским военным судом республики ТатарстанБорисоглебский р-ый суд московского округа,Борисоглебским р-ым судом московского округаАльметьевский городской суд Еврейской автономной области,Альметьевским городским судом Еврейской автономной областиНязепетровский городской суд города Казани,Нязепетровским городским судом города КазаниИсетский военный суд Новгородской области,Исетским военным судом Новгородской областиХилокский кассационный суд Мурманской области,Хилокским кассационным судом Мурманской областиМагарамкентский м-ый суд г. Сыктывкара,Магарамкентским м-ым судом г. СыктывкараЛевокумский кассационный суд респ.татарстан,Левокумским кассационным судом респ.татарстанЗлынковский областной суд нижегородский обл.,Злынковским областным судом нижегородский обл.Шербакульский город суд Архангельской области,Шербакульским городским судом Архангельской областиКлинцовский военный суд г. Красноярска,Клинцовским военным судом г. КрасноярскаКаспийский город. суд московского округа,Каспийским городским судом московского округаУхоловский город суд Липецкой области,Ухоловским городским судом Липецкой областиРыбновский апелляционный суд Калининградской области,Рыбновским апелляционным судом Калининградской областиБабаюртовский межрайонный суд республики Калмыкия,Бабаюртовским межрайонным судом республики КалмыкияСафакулевский кассационный суд ставропольского края,Сафакулевским кассационным судом ставропольского краяШатойский р-ый суд г. Саратова,Шатойским р-ым судом г. СаратоваЗнаменский кассационный суд Мурманской области,Знаменским кассационным судом Мурманской областиФеодосийский апелляционный суд респ. Татарстан,Феодосийским апелляционным судом респ. ТатарстанГрайворонский город суд республики Ингушетия,Грайворонским городским судом республики ИнгушетияВарнавинский город. суд республики Адыгея,Варнавинским городским судом республики АдыгеяФроловский военный суд Курганской области,Фроловским военным судом Курганской областиКрасногорский м-ый суд г. Севастополя,Красногорским м-ым судом г. СевастополяТрусовский м-ый суд АК,Трусовским м-ым судом АКВачский город суд республики Алтай,Вачским городским судом республики АлтайБугурусланский военный суд респ.башкортостан,Бугурусланским военным судом респ.башкортостанАпастовский областной суд Оренбургской области,Апастовским областным судом Оренбургской областиКлимовский апелляционный суд Курганской области,Климовским апелляционным судом Курганской областиЛюблинский р-ый суд приморского края,Люблинским р-ым судом приморского краяМедвенский кассационный суд г. Севастополя,Медвенским кассационным судом г. СевастополяТурочакский областной суд республики Саха (якутия),Турочакским областным судом республики Саха (якутия)